"","manyID","treatyID","Title","Begin","stateID","Signature","Force","End","StateName","gptadID","destaID","StateSignature","StateRatification","StateForce","StateEnd","Rat=Notif","Coder","Source","Succession"
"1","GATT_1947O","GATT_1947O","GATT471947","1947-10-30","AGO","1947-10-30","1948-01-01","01.01.1996","Angola",NA,NA,"1994-04-08",NA,NA,"1996-01-01",NA,"Jael",NA,"0"
"2","GATT_1947O","GATT_1947O","GATT471947","1947-10-30","ATG","1947-10-30","1948-01-01","01.01.1996","Antigua and Barbuda",NA,NA,"1987-03-30",NA,NA,"1996-01-01",NA,"Jael",NA,"0"
"3","GATT_1947O","GATT_1947O","GATT471947","1947-10-30","ARG","1947-10-30","1948-01-01","01.01.1996","Argentina",NA,NA,"1967-10-11",NA,NA,"1996-01-01",NA,"Jael",NA,"0"
"4","GATT_1947O","GATT_1947O","GATT471947","1947-10-30","AUS","1947-10-30","1948-01-01","01.01.1996","Australia",NA,NA,"1948-01-01",NA,NA,"1996-01-01",NA,"Jael",NA,"0"
"5","GATT_1947O","GATT_1947O","GATT471947","1947-10-30","AUT","1947-10-30","1948-01-01","01.01.1996","Austria",NA,NA,"1951-10-19",NA,NA,"1996-01-01",NA,"Jael",NA,"0"
"6","GATT_1947O","GATT_1947O","GATT471947","1947-10-30","BHR","1947-10-30","1948-01-01","01.01.1996","Bahrain",NA,NA,"1993-12-13",NA,NA,"1996-01-01",NA,"Jael",NA,"0"
"7","GATT_1947O","GATT_1947O","GATT471947","1947-10-30","BGD","1947-10-30","1948-01-01","01.01.1996","Bangladesh",NA,NA,"1972-12-16",NA,NA,"1996-01-01",NA,"Jael",NA,"0"
"8","GATT_1947O","GATT_1947O","GATT471947","1947-10-30","BRB","1947-10-30","1948-01-01","01.01.1996","Barbados",NA,NA,"1967-02-15",NA,NA,"1996-01-01",NA,"Jael",NA,"0"
"9","GATT_1947O","GATT_1947O","GATT471947","1947-10-30","BEL","1947-10-30","1948-01-01","01.01.1996","Belgium",NA,NA,"1948-01-01",NA,NA,"1996-01-01",NA,"Jael",NA,"0"
"10","GATT_1947O","GATT_1947O","GATT471947","1947-10-30","BLZ","1947-10-30","1948-01-01","01.01.1996","Belize",NA,NA,"1983-10-07",NA,NA,"1996-01-01",NA,"Jael",NA,"0"
"11","GATT_1947O","GATT_1947O","GATT471947","1947-10-30","BEN","1947-10-30","1948-01-01","01.01.1996","Benin",NA,NA,"1963-09-12",NA,NA,"1996-01-01",NA,"Jael",NA,"0"
"12","GATT_1947O","GATT_1947O","GATT471947","1947-10-30","BOL","1947-10-30","1948-01-01","01.01.1996","Bolivia",NA,NA,"1990-09-08",NA,NA,"1996-01-01",NA,"Jael",NA,"0"
"13","GATT_1947O","GATT_1947O","GATT471947","1947-10-30","BWA","1947-10-30","1948-01-01","01.01.1996","Botswana",NA,NA,"1987-08-28",NA,NA,"1996-01-01",NA,"Jael",NA,"0"
"14","GATT_1947O","GATT_1947O","GATT471947","1947-10-30","BRA","1947-10-30","1948-01-01","01.01.1996","Brazil",NA,NA,"1948-07-30",NA,NA,"1996-01-01",NA,"Jael",NA,"0"
"15","GATT_1947O","GATT_1947O","GATT471947","1947-10-30","BRN","1947-10-30","1948-01-01","01.01.1996","Brunei Darussalam",NA,NA,"1993-12-09",NA,NA,"1996-01-01",NA,"Jael",NA,"0"
"16","GATT_1947O","GATT_1947O","GATT471947","1947-10-30","BFA","1947-10-30","1948-01-01","01.01.1996","Burkina Faso",NA,NA,"1963-05-03",NA,NA,"1996-01-01",NA,"Jael",NA,"0"
"17","GATT_1947O","GATT_1947O","GATT471947","1947-10-30","BDI","1947-10-30","1948-01-01","01.01.1996","Burundi",NA,NA,"1965-03-13",NA,NA,"1996-01-01",NA,"Jael",NA,"0"
"18","GATT_1947O","GATT_1947O","GATT471947","1947-10-30","CMR","1947-10-30","1948-01-01","01.01.1996","Cameroon",NA,NA,"1963-05-03",NA,NA,"1996-01-01",NA,"Jael",NA,"0"
"19","GATT_1947O","GATT_1947O","GATT471947","1947-10-30","CAN","1947-10-30","1948-01-01","01.01.1996","Canada",NA,NA,"1948-01-01",NA,NA,"1996-01-01",NA,"Jael",NA,"0"
"20","GATT_1947O","GATT_1947O","GATT471947","1947-10-30","CAF","1947-10-30","1948-01-01","01.01.1996","Central African Republic",NA,NA,"1963-05-03",NA,NA,"1996-01-01",NA,"Jael",NA,"0"
"21","GATT_1947O","GATT_1947O","GATT471947","1947-10-30","TCD","1947-10-30","1948-01-01","01.01.1996","Chad",NA,NA,"1963-07-12",NA,NA,"1996-01-01",NA,"Jael",NA,"0"
"22","GATT_1947O","GATT_1947O","GATT471947","1947-10-30","CHL","1947-10-30","1948-01-01","01.01.1996","Chile",NA,NA,"1949-03-16",NA,NA,"1996-01-01",NA,"Jael",NA,"0"
"23","GATT_1947O","GATT_1947O","GATT471947","1947-10-30","COL","1947-10-30","1948-01-01","01.01.1996","Colombia",NA,NA,"1981-10-03",NA,NA,"1996-01-01",NA,"Jael",NA,"0"
"24","GATT_1947O","GATT_1947O","GATT471947","1947-10-30","COG","1947-10-30","1948-01-01","01.01.1996","Congo",NA,NA,"1963-05-03",NA,NA,"1996-01-01",NA,"Jael",NA,"0"
"25","GATT_1947O","GATT_1947O","GATT471947","1947-10-30","CRI","1947-10-30","1948-01-01","01.01.1996","Costa Rica",NA,NA,"1990-11-24",NA,NA,"1996-01-01",NA,"Jael",NA,"0"
"26","GATT_1947O","GATT_1947O","GATT471947","1947-10-30","CIV","1947-10-30","1948-01-01","01.01.1996","Cote d'Ivoire",NA,NA,"1963-12-31",NA,NA,"1996-01-01",NA,"Jael",NA,"0"
"27","GATT_1947O","GATT_1947O","GATT471947","1947-10-30","CUB","1947-10-30","1948-01-01","01.01.1996","Cuba",NA,NA,"1948-01-01",NA,NA,"1996-01-01",NA,"Jael",NA,"0"
"28","GATT_1947O","GATT_1947O","GATT471947","1947-10-30","CYP","1947-10-30","1948-01-01","01.01.1996","Cyprus",NA,NA,"1963-07-15",NA,NA,"1996-01-01",NA,"Jael",NA,"0"
"29","GATT_1947O","GATT_1947O","GATT471947","1947-10-30","CZE","1947-10-30","1948-01-01","01.01.1996","Czech Republic",NA,NA,"1993-04-15",NA,NA,"1996-01-01",NA,"Jael","1","1"
"30","GATT_1947O","GATT_1947O","GATT471947","1947-10-30","DNK","1947-10-30","1948-01-01","01.01.1996","Denmark",NA,NA,"1950-05-28",NA,NA,"1996-01-01",NA,"Jael",NA,"0"
"31","GATT_1947O","GATT_1947O","GATT471947","1947-10-30","DJI","1947-10-30","1948-01-01","01.01.1996","Djibouti",NA,NA,"1994-12-16",NA,NA,"1996-01-01",NA,"Jael",NA,"0"
"32","GATT_1947O","GATT_1947O","GATT471947","1947-10-30","DMA","1947-10-30","1948-01-01","01.01.1996","Dominica",NA,NA,"1993-04-20",NA,NA,"1996-01-01",NA,"Jael",NA,"0"
"33","GATT_1947O","GATT_1947O","GATT471947","1947-10-30","DOM","1947-10-30","1948-01-01","01.01.1996","Dominican Republic",NA,NA,"1950-05-19",NA,NA,"1996-01-01",NA,"Jael",NA,"0"
"34","GATT_1947O","GATT_1947O","GATT471947","1947-10-30","EGY","1947-10-30","1948-01-01","01.01.1996","Egypt",NA,NA,"1970-05-09",NA,NA,"1996-01-01",NA,"Jael",NA,"0"
"35","GATT_1947O","GATT_1947O","GATT471947","1947-10-30","SLV","1947-10-30","1948-01-01","01.01.1996","El Salvador",NA,NA,"1991-05-22",NA,NA,"1996-01-01",NA,"Jael",NA,"0"
"36","GATT_1947O","GATT_1947O","GATT471947","1947-10-30","FJI","1947-10-30","1948-01-01","01.01.1996","Fiji",NA,NA,"1993-11-16",NA,NA,"1996-01-01",NA,"Jael",NA,"0"
"37","GATT_1947O","GATT_1947O","GATT471947","1947-10-30","FIN","1947-10-30","1948-01-01","01.01.1996","Finland",NA,NA,"1950-05-25",NA,NA,"1996-01-01",NA,"Jael",NA,"0"
"38","GATT_1947O","GATT_1947O","GATT471947","1947-10-30","FRA","1947-10-30","1948-01-01","01.01.1996","France",NA,NA,"1948-01-01",NA,NA,"1996-01-01",NA,"Jael",NA,"0"
"39","GATT_1947O","GATT_1947O","GATT471947","1947-10-30","GAB","1947-10-30","1948-01-01","01.01.1996","Gabon",NA,NA,"1963-05-03",NA,NA,"1996-01-01",NA,"Jael",NA,"0"
"40","GATT_1947O","GATT_1947O","GATT471947","1947-10-30","GMB","1947-10-30","1948-01-01","01.01.1996","Gambia",NA,NA,"1965-02-22",NA,NA,"1996-01-01",NA,"Jael",NA,"0"
"41","GATT_1947O","GATT_1947O","GATT471947","1947-10-30","DEU","1947-10-30","1948-01-01","01.01.1996","Germany",NA,NA,"1951-10-01",NA,NA,"1996-01-01",NA,"Jael","1","0"
"42","GATT_1947O","GATT_1947O","GATT471947","1947-10-30","GHA","1947-10-30","1948-01-01","01.01.1996","Ghana",NA,NA,"1957-10-17",NA,NA,"1996-01-01",NA,"Jael",NA,"0"
"43","GATT_1947O","GATT_1947O","GATT471947","1947-10-30","GRC","1947-10-30","1948-01-01","01.01.1996","Greece",NA,NA,"1950-03-01",NA,NA,"1996-01-01",NA,"Jael",NA,"0"
"44","GATT_1947O","GATT_1947O","GATT471947","1947-10-30","GRD","1947-10-30","1948-01-01","01.01.1996","Grenada",NA,NA,"1994-02-09",NA,NA,"1996-01-01",NA,"Jael",NA,"0"
"45","GATT_1947O","GATT_1947O","GATT471947","1947-10-30","GTM","1947-10-30","1948-01-01","01.01.1996","Guatemala",NA,NA,"1991-10-10",NA,NA,"1996-01-01",NA,"Jael",NA,"0"
"46","GATT_1947O","GATT_1947O","GATT471947","1947-10-30","GIN","1947-10-30","1948-01-01","01.01.1996","Guinea",NA,NA,"1994-12-08",NA,NA,"1996-01-01",NA,"Jael",NA,"0"
"47","GATT_1947O","GATT_1947O","GATT471947","1947-10-30","GNB","1947-10-30","1948-01-01","01.01.1996","Guinea Bissau",NA,NA,"1994-03-17",NA,NA,"1996-01-01",NA,"Jael",NA,"0"
"48","GATT_1947O","GATT_1947O","GATT471947","1947-10-30","GUY","1947-10-30","1948-01-01","01.01.1996","Guyana",NA,NA,"1966-07-05",NA,NA,"1996-01-01",NA,"Jael",NA,"0"
"49","GATT_1947O","GATT_1947O","GATT471947","1947-10-30","HTI","1947-10-30","1948-01-01","01.01.1996","Haiti",NA,NA,"1950-01-01",NA,NA,"1996-01-01",NA,"Jael",NA,"0"
"50","GATT_1947O","GATT_1947O","GATT471947","1947-10-30","HND","1947-10-30","1948-01-01","01.01.1996","Honduras",NA,NA,"1994-04-10",NA,NA,"1996-01-01",NA,"Jael",NA,"0"
"51","GATT_1947O","GATT_1947O","GATT471947","1947-10-30","HKG","1947-10-30","1948-01-01","01.01.1996","Hong Kong",NA,NA,"1986-04-23",NA,NA,"1996-01-01",NA,"Jael",NA,"0"
"52","GATT_1947O","GATT_1947O","GATT471947","1947-10-30","HUN","1947-10-30","1948-01-01","01.01.1996","Hungary",NA,NA,"1973-09-09",NA,NA,"1996-01-01",NA,"Jael",NA,"0"
"53","GATT_1947O","GATT_1947O","GATT471947","1947-10-30","ISL","1947-10-30","1948-01-01","01.01.1996","Iceland",NA,NA,"1968-04-21",NA,NA,"1996-01-01",NA,"Jael",NA,"0"
"54","GATT_1947O","GATT_1947O","GATT471947","1947-10-30","IND","1947-10-30","1948-01-01","01.01.1996","India",NA,NA,"1948-07-08",NA,NA,"1996-01-01",NA,"Jael",NA,"0"
"55","GATT_1947O","GATT_1947O","GATT471947","1947-10-30","IDN","1947-10-30","1948-01-01","01.01.1996","Indonesia",NA,NA,"1950-02-24",NA,NA,"1996-01-01",NA,"Jael",NA,"0"
"56","GATT_1947O","GATT_1947O","GATT471947","1947-10-30","IRL","1947-10-30","1948-01-01","01.01.1996","Ireland",NA,NA,"1967-12-22",NA,NA,"1996-01-01",NA,"Jael",NA,"0"
"57","GATT_1947O","GATT_1947O","GATT471947","1947-10-30","ISR","1947-10-30","1948-01-01","01.01.1996","Israel",NA,NA,"1962-07-05",NA,NA,"1996-01-01",NA,"Jael",NA,"0"
"58","GATT_1947O","GATT_1947O","GATT471947","1947-10-30","ITA","1947-10-30","1948-01-01","01.01.1996","Italy",NA,NA,"1950-05-30",NA,NA,"1996-01-01",NA,"Jael",NA,"0"
"59","GATT_1947O","GATT_1947O","GATT471947","1947-10-30","JAM","1947-10-30","1948-01-01","01.01.1996","Jamaica",NA,NA,"1963-12-31",NA,NA,"1996-01-01",NA,"Jael",NA,"0"
"60","GATT_1947O","GATT_1947O","GATT471947","1947-10-30","JPN","1947-10-30","1948-01-01","01.01.1996","Japan",NA,NA,"1955-09-10",NA,NA,"1996-01-01",NA,"Jael",NA,"0"
"61","GATT_1947O","GATT_1947O","GATT471947","1947-10-30","KEN","1947-10-30","1948-01-01","01.01.1996","Kenya",NA,NA,"1964-02-05",NA,NA,"1996-01-01",NA,"Jael",NA,"0"
"62","GATT_1947O","GATT_1947O","GATT471947","1947-10-30","KOR","1947-10-30","1948-01-01","01.01.1996","Korea",NA,NA,"1967-04-14",NA,NA,"1996-01-01",NA,"Jael",NA,"0"
"63","GATT_1947O","GATT_1947O","GATT471947","1947-10-30","KWT","1947-10-30","1948-01-01","01.01.1996","Kuwait",NA,NA,"1963-05-03",NA,NA,"1996-01-01",NA,"Jael",NA,"0"
"64","GATT_1947O","GATT_1947O","GATT471947","1947-10-30","LSO","1947-10-30","1948-01-01","01.01.1996","Lesotho",NA,NA,"1988-01-08",NA,NA,"1996-01-01",NA,"Jael",NA,"0"
"65","GATT_1947O","GATT_1947O","GATT471947","1947-10-30","LIE","1947-10-30","1948-01-01","01.01.1996","Liechtenstein",NA,NA,"1994-03-29",NA,NA,"1996-01-01",NA,"Jael",NA,"0"
"66","GATT_1947O","GATT_1947O","GATT471947","1947-10-30","LUX","1947-10-30","1948-01-01","01.01.1996","Luxembourg",NA,NA,"1948-01-01",NA,NA,"1996-01-01",NA,"Jael",NA,"0"
"67","GATT_1947O","GATT_1947O","GATT471947","1947-10-30",NA,"1947-10-30","1948-01-01","01.01.1996","Macao",NA,NA,"1991-01-11",NA,NA,"1996-01-01",NA,"Jael",NA,"0"
"68","GATT_1947O","GATT_1947O","GATT471947","1947-10-30","MDG","1947-10-30","1948-01-01","01.01.1996","Madagascar",NA,NA,"1963-09-30",NA,NA,"1996-01-01",NA,"Jael",NA,"0"
"69","GATT_1947O","GATT_1947O","GATT471947","1947-10-30","MWI","1947-10-30","1948-01-01","01.01.1996","Malawi",NA,NA,"1964-08-28",NA,NA,"1996-01-01",NA,"Jael",NA,"0"
"70","GATT_1947O","GATT_1947O","GATT471947","1947-10-30","MYS","1947-10-30","1948-01-01","01.01.1996","Malaysia",NA,NA,"1957-10-24",NA,NA,"1996-01-01",NA,"Jael",NA,"0"
"71","GATT_1947O","GATT_1947O","GATT471947","1947-10-30","MDV","1947-10-30","1948-01-01","01.01.1996","Maldives",NA,NA,"1983-04-19",NA,NA,"1996-01-01",NA,"Jael",NA,"0"
"72","GATT_1947O","GATT_1947O","GATT471947","1947-10-30","MLI","1947-10-30","1948-01-01","01.01.1996","Mali",NA,NA,"1993-01-11",NA,NA,"1996-01-01",NA,"Jael",NA,"0"
"73","GATT_1947O","GATT_1947O","GATT471947","1947-10-30","MLT","1947-10-30","1948-01-01","01.01.1996","Malta",NA,NA,"1964-11-17",NA,NA,"1996-01-01",NA,"Jael",NA,"0"
"74","GATT_1947O","GATT_1947O","GATT471947","1947-10-30","MRT","1947-10-30","1948-01-01","01.01.1996","Mauritania",NA,NA,"1963-09-30",NA,NA,"1996-01-01",NA,"Jael",NA,"0"
"75","GATT_1947O","GATT_1947O","GATT471947","1947-10-30","MUS","1947-10-30","1948-01-01","01.01.1996","Mauritius",NA,NA,"1970-09-02",NA,NA,"1996-01-01",NA,"Jael",NA,"0"
"76","GATT_1947O","GATT_1947O","GATT471947","1947-10-30","MEX","1947-10-30","1948-01-01","01.01.1996","Mexico",NA,NA,"1986-08-24",NA,NA,"1996-01-01",NA,"Jael",NA,"1"
"77","GATT_1947O","GATT_1947O","GATT471947","1947-10-30","MAR","1947-10-30","1948-01-01","01.01.1996","Morocco",NA,NA,"1987-06-17",NA,NA,"1996-01-01",NA,"Jael",NA,"0"
"78","GATT_1947O","GATT_1947O","GATT471947","1947-10-30","MOZ","1947-10-30","1948-01-01","01.01.1996","Mozambique",NA,NA,"1992-07-27",NA,NA,"1996-01-01",NA,"Jael",NA,"0"
"79","GATT_1947O","GATT_1947O","GATT471947","1947-10-30","MMR","1947-10-30","1948-01-01","01.01.1996","Myanmar",NA,NA,"1948-07-29",NA,NA,"1996-01-01",NA,"Jael",NA,"0"
"80","GATT_1947O","GATT_1947O","GATT471947","1947-10-30","NAM","1947-10-30","1948-01-01","01.01.1996","Namibia",NA,NA,"1992-09-15",NA,NA,"1996-01-01",NA,"Jael",NA,"0"
"81","GATT_1947O","GATT_1947O","GATT471947","1947-10-30","NLD","1947-10-30","1948-01-01","01.01.1996","Netherlands",NA,NA,"1948-01-01",NA,NA,"1996-01-01",NA,"Jael",NA,"0"
"82","GATT_1947O","GATT_1947O","GATT471947","1947-10-30","NZL","1947-10-30","1948-01-01","01.01.1996","New Zealand",NA,NA,"1948-07-30",NA,NA,"1996-01-01",NA,"Jael",NA,"0"
"83","GATT_1947O","GATT_1947O","GATT471947","1947-10-30","NIC","1947-10-30","1948-01-01","01.01.1996","Nicaragua",NA,NA,"1950-05-28",NA,NA,"1996-01-01",NA,"Jael",NA,"0"
"84","GATT_1947O","GATT_1947O","GATT471947","1947-10-30","NER","1947-10-30","1948-01-01","01.01.1996","Niger",NA,NA,"1963-12-31",NA,NA,"1996-01-01",NA,"Jael",NA,"0"
"85","GATT_1947O","GATT_1947O","GATT471947","1947-10-30","NGA","1947-10-30","1948-01-01","01.01.1996","Nigeria",NA,NA,"1960-11-18",NA,NA,"1996-01-01",NA,"Jael",NA,"0"
"86","GATT_1947O","GATT_1947O","GATT471947","1947-10-30","NOR","1947-10-30","1948-01-01","01.01.1996","Norway",NA,NA,"1948-07-10",NA,NA,"1996-01-01",NA,"Jael",NA,"0"
"87","GATT_1947O","GATT_1947O","GATT471947","1947-10-30","PAK","1947-10-30","1948-01-01","01.01.1996","Pakistan",NA,NA,"1948-07-30",NA,NA,"1996-01-01",NA,"Jael",NA,"0"
"88","GATT_1947O","GATT_1947O","GATT471947","1947-10-30","PNG","1947-10-30","1948-01-01","01.01.1996","Papua New Guinea",NA,NA,"1994-12-16",NA,NA,"1996-01-01",NA,"Jael",NA,"0"
"89","GATT_1947O","GATT_1947O","GATT471947","1947-10-30","PRY","1947-10-30","1948-01-01","01.01.1996","Paraguay",NA,NA,"1994-01-06",NA,NA,"1996-01-01",NA,"Jael",NA,"0"
"90","GATT_1947O","GATT_1947O","GATT471947","1947-10-30","PER","1947-10-30","1948-01-01","01.01.1996","Peru",NA,NA,"1951-10-07",NA,NA,"1996-01-01",NA,"Jael",NA,"0"
"91","GATT_1947O","GATT_1947O","GATT471947","1947-10-30","PHL","1947-10-30","1948-01-01","01.01.1996","Philippines",NA,NA,"1979-12-27",NA,NA,"1996-01-01",NA,"Jael",NA,"0"
"92","GATT_1947O","GATT_1947O","GATT471947","1947-10-30","POL","1947-10-30","1948-01-01","01.01.1996","Poland",NA,NA,"1967-10-18",NA,NA,"1996-01-01",NA,"Jael",NA,"0"
"93","GATT_1947O","GATT_1947O","GATT471947","1947-10-30","PRT","1947-10-30","1948-01-01","01.01.1996","Portugal",NA,NA,"1962-05-06",NA,NA,"1996-01-01",NA,"Jael",NA,"0"
"94","GATT_1947O","GATT_1947O","GATT471947","1947-10-30","QAT","1947-10-30","1948-01-01","01.01.1996","Qatar",NA,NA,"1994-04-07",NA,NA,"1996-01-01",NA,"Jael",NA,"0"
"95","GATT_1947O","GATT_1947O","GATT471947","1947-10-30","ROU","1947-10-30","1948-01-01","01.01.1996","Romania",NA,NA,"1971-11-14",NA,NA,"1996-01-01",NA,"Jael",NA,"0"
"96","GATT_1947O","GATT_1947O","GATT471947","1947-10-30","RWA","1947-10-30","1948-01-01","01.01.1996","Rwanda",NA,NA,"1966-01-01",NA,NA,"1996-01-01",NA,"Jael",NA,"0"
"97","GATT_1947O","GATT_1947O","GATT471947","1947-10-30","SEN","1947-10-30","1948-01-01","01.01.1996","Senegal",NA,NA,"1963-09-27",NA,NA,"1996-01-01",NA,"Jael",NA,"0"
"98","GATT_1947O","GATT_1947O","GATT471947","1947-10-30","SLE","1947-10-30","1948-01-01","01.01.1996","Sierra Leone",NA,NA,"1961-05-19",NA,NA,"1996-01-01",NA,"Jael",NA,"0"
"99","GATT_1947O","GATT_1947O","GATT471947","1947-10-30","SGP","1947-10-30","1948-01-01","01.01.1996","Singapore",NA,NA,"1973-08-20",NA,NA,"1996-01-01",NA,"Jael",NA,"0"
"100","GATT_1947O","GATT_1947O","GATT471947","1947-10-30","SVK","1947-10-30","1948-01-01","01.01.1996","Slovak Republic",NA,NA,"1993-04-15",NA,NA,"1996-01-01",NA,"Jael",NA,"0"
"101","GATT_1947O","GATT_1947O","GATT471947","1947-10-30","SVN","1947-10-30","1948-01-01","01.01.1996","Slovenia",NA,NA,"1994-10-30",NA,NA,"1996-01-01",NA,"Jael",NA,"1"
"102","GATT_1947O","GATT_1947O","GATT471947","1947-10-30","SLB","1947-10-30","1948-01-01","01.01.1996","Solomon Islands",NA,NA,"1994-12-28",NA,NA,"1996-01-01",NA,"Jael",NA,"0"
"103","GATT_1947O","GATT_1947O","GATT471947","1947-10-30","ZAF","1947-10-30","1948-01-01","01.01.1996","South Africa",NA,NA,"1948-06-13",NA,NA,"1996-01-01",NA,"Jael",NA,"0"
"104","GATT_1947O","GATT_1947O","GATT471947","1947-10-30","ESP","1947-10-30","1948-01-01","01.01.1996","Spain",NA,NA,"1963-08-29",NA,NA,"1996-01-01",NA,"Jael",NA,"0"
"105","GATT_1947O","GATT_1947O","GATT471947","1947-10-30","LKA","1947-10-30","1948-01-01","01.01.1996","Sri Lanka",NA,NA,"1948-07-29",NA,NA,"1996-01-01",NA,"Jael",NA,"0"
"106","GATT_1947O","GATT_1947O","GATT471947","1947-10-30","KNA","1947-10-30","1948-01-01","01.01.1996","St. Kitts and Nevis",NA,NA,"1994-03-24",NA,NA,"1996-01-01",NA,"Jael",NA,"0"
"107","GATT_1947O","GATT_1947O","GATT471947","1947-10-30","LCA","1947-10-30","1948-01-01","01.01.1996","St. Lucia",NA,NA,"1993-04-13",NA,NA,"1996-01-01",NA,"Jael",NA,"0"
"108","GATT_1947O","GATT_1947O","GATT471947","1947-10-30","VCT","1947-10-30","1948-01-01","01.01.1996","St. Vincent and the Grenadines",NA,NA,"1993-05-18",NA,NA,"1996-01-01",NA,"Jael",NA,"0"
"109","GATT_1947O","GATT_1947O","GATT471947","1947-10-30","SUR","1947-10-30","1948-01-01","01.01.1996","Suriname",NA,NA,"1978-03-22",NA,NA,"1996-01-01",NA,"Jael",NA,"0"
"110","GATT_1947O","GATT_1947O","GATT471947","1947-10-30","SWZ","1947-10-30","1948-01-01","01.01.1996","Eswatini",NA,NA,"1993-02-08",NA,NA,"1996-01-01",NA,"Jael",NA,"0"
"111","GATT_1947O","GATT_1947O","GATT471947","1947-10-30","SWE","1947-10-30","1948-01-01","01.01.1996","Sweden",NA,NA,"1950-04-30",NA,NA,"1996-01-01",NA,"Jael",NA,"0"
"112","GATT_1947O","GATT_1947O","GATT471947","1947-10-30","CHE","1947-10-30","1948-01-01","01.01.1996","Switzerland",NA,NA,"1966-08-01",NA,NA,"1996-01-01",NA,"Jael",NA,"0"
"113","GATT_1947O","GATT_1947O","GATT471947","1947-10-30","TZA","1947-10-30","1948-01-01","01.01.1996","Tanzania",NA,NA,"1961-12-09",NA,NA,"1996-01-01",NA,"Jael",NA,"0"
"114","GATT_1947O","GATT_1947O","GATT471947","1947-10-30","THA","1947-10-30","1948-01-01","01.01.1996","Thailand",NA,NA,"1982-11-20",NA,NA,"1996-01-01",NA,"Jael",NA,"0"
"115","GATT_1947O","GATT_1947O","GATT471947","1947-10-30","TGO","1947-10-30","1948-01-01","01.01.1996","Togo",NA,NA,"1964-03-20",NA,NA,"1996-01-01",NA,"Jael",NA,"0"
"116","GATT_1947O","GATT_1947O","GATT471947","1947-10-30","TTO","1947-10-30","1948-01-01","01.01.1996","Trinidad and Tobago",NA,NA,"1962-10-23",NA,NA,"1996-01-01",NA,"Jael",NA,"0"
"117","GATT_1947O","GATT_1947O","GATT471947","1947-10-30","TUN","1947-10-30","1948-01-01","01.01.1996","Tunisia",NA,NA,"1990-08-29",NA,NA,"1996-01-01",NA,"Jael",NA,"0"
"118","GATT_1947O","GATT_1947O","GATT471947","1947-10-30","TUR","1947-10-30","1948-01-01","01.01.1996","Turkey",NA,NA,"1951-10-17",NA,NA,"1996-01-01",NA,"Jael",NA,"0"
"119","GATT_1947O","GATT_1947O","GATT471947","1947-10-30","UGA","1947-10-30","1948-01-01","01.01.1996","Uganda",NA,NA,"1962-10-23",NA,NA,"1996-01-01",NA,"Jael",NA,"0"
"120","GATT_1947O","GATT_1947O","GATT471947","1947-10-30","ARE","1947-10-30","1948-01-01","01.01.1996","United Arab Emirates",NA,NA,"1994-03-08",NA,NA,"1996-01-01",NA,"Jael",NA,"0"
"121","GATT_1947O","GATT_1947O","GATT471947","1947-10-30","GBR","1947-10-30","1948-01-01","01.01.1996","United Kingdom",NA,NA,"1948-01-01",NA,NA,"1996-01-01",NA,"Jael",NA,"0"
"122","GATT_1947O","GATT_1947O","GATT471947","1947-10-30","USA","1947-10-30","1948-01-01","01.01.1996","United States of America",NA,NA,"1948-01-01",NA,NA,"1996-01-01",NA,"Jael",NA,"0"
"123","GATT_1947O","GATT_1947O","GATT471947","1947-10-30","URY","1947-10-30","1948-01-01","01.01.1996","Uruguay",NA,NA,"1953-12-06",NA,NA,"1996-01-01",NA,"Jael",NA,"0"
"124","GATT_1947O","GATT_1947O","GATT471947","1947-10-30","VEN","1947-10-30","1948-01-01","01.01.1996","Venezuela",NA,NA,"1990-08-31",NA,NA,"1996-01-01",NA,"Jael",NA,"0"
"125","GATT_1947O","GATT_1947O","GATT471947","1947-10-30","YUG","1947-10-30","1948-01-01","01.01.1996","Yugoslavia",NA,NA,"1966-08-25",NA,NA,"1996-01-01",NA,"Jael",NA,"1"
"126","GATT_1947O","GATT_1947O","GATT471947","1947-10-30","COD","1947-10-30","1948-01-01","01.01.1996","Democratic Republic of the Congo",NA,NA,"1971-09-11",NA,NA,"1996-01-01",NA,"Jael",NA,"0"
"127","GATT_1947O","GATT_1947O","GATT471947","1947-10-30","ZMB","1947-10-30","1948-01-01","01.01.1996","Zambia",NA,NA,"1982-02-10",NA,NA,"1996-01-01",NA,"Jael",NA,"0"
"128","GATT_1947O","GATT_1947O","GATT471947","1947-10-30","ZWE","1947-10-30","1948-01-01","01.01.1996","Zimbabwe",NA,NA,"1948-07-11",NA,NA,"1996-01-01",NA,"Jael",NA,"0"
"129","ZAF-ZWE[RCU]_1948O","ZAF-ZWE[RCU]_1948O","South Africa Southern Rhodesia Customs Union","1948-12-06","ZAF","1948-12-06","1949-04-01",NA,"South Africa",NA,"663","1948-12-06",NA,"1949-04-01",NA,NA,"Anders",NA,"0"
"130","ZAF-ZWE[RCU]_1948O","ZAF-ZWE[RCU]_1948O","South Africa Southern Rhodesia Customs Union","1948-12-06","ZWE","1948-12-06","1949-04-01",NA,"Zimbabwe",NA,"663","1948-12-06",NA,"1949-04-01",NA,NA,"Anders",NA,"0"
"131","BTN-IND[NA]_1949O","BTN-IND[NA]_1949O","Bhutan India","1949-08-08","BTN","1949-08-08",NA,"02.03.2007","Bhutan",NA,"707",NA,"1949-09-15",NA,"2007-03-02",NA,"Jael",NA,"0"
"132","BTN-IND[NA]_1949O","BTN-IND[NA]_1949O","Bhutan India","1949-08-08","IND","1949-08-08",NA,"02.03.2007","India",NA,"707",NA,"1949-09-22",NA,"2007-03-02",NA,"Jael",NA,"0"
"133","NIC-SLV[FTA]_1951O","NIC-SLV[FTA]_1951O","El Salvador Nicaragua Free Trade Area","1951-03-09","NIC","1951-03-09","1951-08-21",NA,"Nicaragua",NA,"418","1951-03-09",NA,"1951-08-21",NA,NA,"Anders",NA,"0"
"134","NIC-SLV[FTA]_1951O","NIC-SLV[FTA]_1951O","El Salvador Nicaragua Free Trade Area","1951-03-09","SLV","1951-03-09","1951-08-21",NA,"El Salvador",NA,"418","1951-03-09",NA,"1951-08-21",NA,NA,"Anders",NA,"0"
"135","ERPCSC_1951O","ERPCSC_1951O","European Coal And Steel Community","1951-04-18","BEL","1951-04-18","1952-07-23","23.07.2002","Belgium",NA,"436","1951-04-18","1952-02-05","1952-07-23","2002-07-23",NA,"Anders",NA,"0"
"136","ERPCSC_1951O","ERPCSC_1951O","European Coal And Steel Community","1951-04-18","DEU","1951-04-18","1952-07-23","23.07.2002","Germany",NA,"436","1951-04-18","1952-01-11","1952-07-23","2002-07-23",NA,"Anders",NA,"0"
"137","ERPCSC_1951O","ERPCSC_1951O","European Coal And Steel Community","1951-04-18","FRA","1951-04-18","1952-07-23","23.07.2002","France",NA,"436","1951-04-18","1952-04-01","1952-07-23","2002-07-23",NA,"Anders",NA,"0"
"138","ERPCSC_1951O","ERPCSC_1951O","European Coal And Steel Community","1951-04-18","ITA","1951-04-18","1952-07-23","23.07.2002","Italy",NA,"436","1951-04-18","1952-03-15","1952-07-23","2002-07-23",NA,"Anders",NA,"0"
"139","ERPCSC_1951O","ERPCSC_1951O","European Coal And Steel Community","1951-04-18","LUX","1951-04-18","1952-07-23","23.07.2002","Luxembourg",NA,"436","1951-04-18","1952-05-13","1952-07-23","2002-07-23",NA,"Anders",NA,"0"
"140","ERPCSC_1951O","ERPCSC_1951O","European Coal And Steel Community","1951-04-18","NLD","1951-04-18","1952-07-23","23.07.2002","Netherlands",NA,"436","1951-04-18","1952-02-19","1952-07-23","2002-07-23",NA,"Anders",NA,"0"
"141","ERPCSC_1951O","ERPCSC_1951O","European Coal And Steel Community","1951-04-18","DNK","1951-04-18","1952-07-23","23.07.2002","Denmark",NA,"436",NA,"1972-10-02","1973-01-01","2002-07-23",NA,"Jael",NA,"0"
"142","ERPCSC_1951O","ERPCSC_1951O","European Coal And Steel Community","1951-04-18","IRL","1951-04-18","1952-07-23","23.07.2002","Ireland",NA,"436",NA,"1972-12-06","1973-01-01","2002-07-23",NA,"Jael",NA,"0"
"143","ERPCSC_1951O","ERPCSC_1951O","European Coal And Steel Community","1951-04-18","GBR","1951-04-18","1952-07-23","23.07.2002","United Kingdom",NA,"436",NA,"1972-10-17","1973-01-01","2002-07-23",NA,"Jael",NA,"0"
"144","ERPCSC_1951O","ERPCSC_1951O","European Coal And Steel Community","1951-04-18","GRC","1951-04-18","1952-07-23","23.07.2002","Greece",NA,"436",NA,"1979-06-28","1981-01-01","2002-07-23",NA,"Jael",NA,"0"
"145","ERPCSC_1951O","ERPCSC_1951O","European Coal And Steel Community","1951-04-18","ESP","1951-04-18","1952-07-23","23.07.2002","Spain",NA,"436",NA,"1985-06-12","1986-01-01","2002-07-23",NA,"Jael",NA,"0"
"146","ERPCSC_1951O","ERPCSC_1951O","European Coal And Steel Community","1951-04-18","PRT","1951-04-18","1952-07-23","23.07.2002","Portugal",NA,"436",NA,"1985-06-12","1986-01-01","2002-07-23",NA,"Jael",NA,"0"
"147","IRQ-JOR[NA]_1953O","IRQ-JOR[NA]_1953O","Iraq Jordan","1953-01-01","IRQ","1953-01-01","1953-01-01",NA,"Iraq",NA,"500",NA,NA,NA,NA,NA,"Anders",NA,"0"
"148","IRQ-JOR[NA]_1953O","IRQ-JOR[NA]_1953O","Iraq Jordan","1953-01-01","JOR","1953-01-01","1953-01-01",NA,"Jordan",NA,"500",NA,NA,NA,NA,NA,"Anders",NA,"0"
"149","ARTTTT_1953A","ARTTTT_1953A","Arab Trade Convention Treaty On Transit Trade","1953-09-07","EGY","1953-09-07",NA,NA,"Egypt",NA,"695","1953-09-07","1953-11-12",NA,NA,NA,"Anders",NA,"0"
"150","ARTTTT_1953A","ARTTTT_1953A","Arab Trade Convention Treaty On Transit Trade","1953-09-07","IRQ","1953-09-07",NA,NA,"Iraq",NA,"695","1953-09-07","1954-12-25",NA,NA,NA,"Anders",NA,"0"
"151","ARTTTT_1953A","ARTTTT_1953A","Arab Trade Convention Treaty On Transit Trade","1953-09-07","JOR","1953-09-07",NA,NA,"Jordan",NA,"695","1953-09-07","1953-10-27",NA,NA,NA,"Anders",NA,"0"
"152","ARTTTT_1953A","ARTTTT_1953A","Arab Trade Convention Treaty On Transit Trade","1953-09-07","KWT","1953-09-07",NA,NA,"Kuwait",NA,"695",NA,NA,NA,NA,NA,"Anders",NA,"0"
"153","ARTTTT_1953A","ARTTTT_1953A","Arab Trade Convention Treaty On Transit Trade","1953-09-07","LBN","1953-09-07",NA,NA,"Lebanon",NA,"695","1953-09-07","1953-09-17",NA,NA,NA,"Anders",NA,"0"
"154","ARTTTT_1953A","ARTTTT_1953A","Arab Trade Convention Treaty On Transit Trade","1953-09-07","SAU","1953-09-07",NA,NA,"Saudi Arabia",NA,"695","1953-09-13","1954-02-23",NA,NA,NA,"Anders",NA,"0"
"155","ARTTTT_1953A","ARTTTT_1953A","Arab Trade Convention Treaty On Transit Trade","1953-09-07","SYR","1953-09-07",NA,NA,"Syria",NA,"695","1953-09-07","1954-12-25",NA,NA,NA,"Anders",NA,"0"
"156","CAN-ESP[NA]_1954O","CAN-ESP[NA]_1954O","Canada Spain","1954-05-26","CAN","1954-05-26","1954-07-01","31.12.9999","Canada",NA,"784","1954-05-26",NA,"1954-07-01","9999-12-31",NA,"Anders",NA,"0"
"157","CAN-ESP[NA]_1954O","CAN-ESP[NA]_1954O","Canada Spain","1954-05-26","ESP","1954-05-26","1954-07-01","31.12.9999","Spain",NA,"784","1954-05-26",NA,"1954-07-01","9999-12-31",NA,"Anders",NA,"0"
"158","CAN-PRT[NA]_1954O","CAN-PRT[NA]_1954O","Canada Portugal","1954-05-28","CAN","1954-05-28","1954-07-01","31.12.9999","Canada",NA,"783","1954-05-28",NA,"1954-07-01","9999-12-31",NA,"Anders",NA,"0"
"159","CAN-PRT[NA]_1954O","CAN-PRT[NA]_1954O","Canada Portugal","1954-05-28","PRT","1954-05-28","1954-07-01","31.12.9999","Portugal",NA,"783","1954-05-28",NA,"1954-07-01","9999-12-31",NA,"Anders",NA,"0"
"160","FRA-TUN[CSU]_1955A","FRA-TUN[CSU]_1955A","France Tunisia Customs Union Convention","1955-01-01","FRA","1955-01-01","1956-01-01",NA,"France",NA,"453","1955-06-03",NA,"1956-01-01",NA,NA,"Anders",NA,"0"
"161","FRA-TUN[CSU]_1955A","FRA-TUN[CSU]_1955A","France Tunisia Customs Union Convention","1955-01-01","TUN","1955-01-01","1956-01-01",NA,"Tunisia",NA,"453","1955-06-03",NA,"1956-01-01",NA,NA,"Anders",NA,"0"
"162","EC_1957A","EC_1957A","EC (Treaty Of Rome)","1957-03-25","AUT","1957-03-25","1958-01-01","31.12.9999","Austria","130","293","1994-06-24",NA,"1995-01-01","9999-12-31",NA,"Anders",NA,"0"
"163","EC_1957A","EC_1957A","EC (Treaty Of Rome)","1957-03-25","BEL","1957-03-25","1958-01-01","31.12.9999","Belgium","130","293","1957-03-25","1957-11-19","1958-01-01","9999-12-31",NA,"Anders",NA,"0"
"164","EC_1957A","EC_1957A","EC (Treaty Of Rome)","1957-03-25","DEU","1957-03-25","1958-01-01","31.12.9999","Germany","130","293","1957-03-25","1957-07-19","1958-01-01","9999-12-31",NA,"Anders",NA,"0"
"165","EC_1957A","EC_1957A","EC (Treaty Of Rome)","1957-03-25","DNK","1957-03-25","1958-01-01","31.12.9999","Denmark","130","293",NA,"1972-10-02","1973-01-01","9999-12-31",NA,"Anders",NA,"0"
"166","EC_1957A","EC_1957A","EC (Treaty Of Rome)","1957-03-25","ESP","1957-03-25","1958-01-01","31.12.9999","Spain","130","293","1985-12-06",NA,"1986-01-01","9999-12-31",NA,"Anders",NA,"0"
"167","EC_1957A","EC_1957A","EC (Treaty Of Rome)","1957-03-25","FIN","1957-03-25","1958-01-01","31.12.9999","Finland","130","293","1994-06-24",NA,"1995-01-01","9999-12-31",NA,"Anders",NA,"0"
"168","EC_1957A","EC_1957A","EC (Treaty Of Rome)","1957-03-25","FRA","1957-03-25","1958-01-01","31.12.9999","France","130","293","1957-03-25","1957-06-25","1958-01-01","9999-12-31",NA,"Anders",NA,"0"
"169","EC_1957A","EC_1957A","EC (Treaty Of Rome)","1957-03-25","GBR","1957-03-25","1958-01-01","31.12.9999","United Kingdom","130","293",NA,"1972-10-17","1973-01-01","2020-02-01",NA,"Anders",NA,"0"
"170","EC_1957A","EC_1957A","EC (Treaty Of Rome)","1957-03-25","GRC","1957-03-25","1958-01-01","31.12.9999","Greece","130","293",NA,"1979-06-28","1981-01-01","9999-12-31",NA,"Anders",NA,"0"
"171","EC_1957A","EC_1957A","EC (Treaty Of Rome)","1957-03-25","IRL","1957-03-25","1958-01-01","31.12.9999","Ireland","130","293",NA,"1972-12-06","1973-01-01","9999-12-31",NA,"Anders",NA,"0"
"172","EC_1957A","EC_1957A","EC (Treaty Of Rome)","1957-03-25","ITA","1957-03-25","1958-01-01","31.12.9999","Italy","130","293","1957-03-25","1957-06-09","1958-01-01","9999-12-31",NA,"Anders",NA,"0"
"173","EC_1957A","EC_1957A","EC (Treaty Of Rome)","1957-03-25","LUX","1957-03-25","1958-01-01","31.12.9999","Luxembourg","130","293","1957-03-25","1957-11-26","1958-01-01","9999-12-31",NA,"Anders",NA,"0"
"174","EC_1957A","EC_1957A","EC (Treaty Of Rome)","1957-03-25","NLD","1957-03-25","1958-01-01","31.12.9999","Netherlands","130","293","1957-03-25","1957-10-04","1958-01-01","9999-12-31",NA,"Anders",NA,"0"
"175","EC_1957A","EC_1957A","EC (Treaty Of Rome)","1957-03-25","PRT","1957-03-25","1958-01-01","31.12.9999","Portugal","130","293","1985-12-06",NA,"1986-01-01","9999-12-31",NA,"Anders",NA,"0"
"176","EC_1957A","EC_1957A","EC (Treaty Of Rome)","1957-03-25","SWE","1957-03-25","1958-01-01","31.12.9999","Sweden","130","293","1994-06-24",NA,"1995-01-01","9999-12-31",NA,"Anders",NA,"0"
"177","EC_1957A","EC_1957A","EC (Treaty Of Rome)","1957-03-25","CYP","1957-03-25","1958-01-01","31.12.9999","Cyprus","130","293","2003-04-16",NA,"2004-05-01","9999-12-31",NA,"Jael",NA,"0"
"178","EC_1957A","EC_1957A","EC (Treaty Of Rome)","1957-03-25","CZE","1957-03-25","1958-01-01","31.12.9999","Czech Republic","130","293","2003-04-16",NA,"2004-05-01","9999-12-31",NA,"Jael",NA,"1"
"179","EC_1957A","EC_1957A","EC (Treaty Of Rome)","1957-03-25","EST","1957-03-25","1958-01-01","31.12.9999","Estonia","130","293","2003-04-16",NA,"2004-05-01","9999-12-31",NA,"Jael",NA,"1"
"180","EC_1957A","EC_1957A","EC (Treaty Of Rome)","1957-03-25","HUN","1957-03-25","1958-01-01","31.12.9999","Hungary","130","293","2003-04-16",NA,"2004-05-01","9999-12-31",NA,"Jael",NA,"0"
"181","EC_1957A","EC_1957A","EC (Treaty Of Rome)","1957-03-25","LTU","1957-03-25","1958-01-01","31.12.9999","Lithuania","130","293","2003-04-16",NA,"2004-05-01","9999-12-31",NA,"Jael",NA,"1"
"182","EC_1957A","EC_1957A","EC (Treaty Of Rome)","1957-03-25","LVA","1957-03-25","1958-01-01","31.12.9999","Latvia","130","293","2003-04-16",NA,"2004-05-01","9999-12-31",NA,"Jael",NA,"1"
"183","EC_1957A","EC_1957A","EC (Treaty Of Rome)","1957-03-25","MLT","1957-03-25","1958-01-01","31.12.9999","Malta","130","293","2003-04-16",NA,"2004-05-01","9999-12-31",NA,"Jael",NA,"0"
"184","EC_1957A","EC_1957A","EC (Treaty Of Rome)","1957-03-25","POL","1957-03-25","1958-01-01","31.12.9999","Poland","130","293","2003-04-16",NA,"2004-05-01","9999-12-31",NA,"Jael",NA,"0"
"185","EC_1957A","EC_1957A","EC (Treaty Of Rome)","1957-03-25","SVK","1957-03-25","1958-01-01","31.12.9999","Slovakia","130","293","2003-04-16",NA,"2004-05-01","9999-12-31",NA,"Jael",NA,"1"
"186","EC_1957A","EC_1957A","EC (Treaty Of Rome)","1957-03-25","SVN","1957-03-25","1958-01-01","31.12.9999","Slovenia","130","293","2003-04-16",NA,"2004-05-01","9999-12-31",NA,"Jael",NA,"1"
"187","EC_1957A","EC_1957A","EC (Treaty Of Rome)","1957-03-25","BGR","1957-03-25","1958-01-01","31.12.9999","Bulgaria","130","293","2005-04-25",NA,"2007-01-01","9999-12-31",NA,"Jael",NA,"0"
"188","EC_1957A","EC_1957A","EC (Treaty Of Rome)","1957-03-25","ROU","1957-03-25","1958-01-01","31.12.9999","Romania","130","293","2005-04-25",NA,"2007-01-01","9999-12-31",NA,"Jael",NA,"0"
"189","EC_1957A","EC_1957A","EC (Treaty Of Rome)","1957-03-25","HRV","1957-03-25","1958-01-01","31.12.9999","Croatia","130","293","2011-12-09",NA,"2013-07-01","9999-12-31",NA,"Jael",NA,"1"
"190","BNLXEU_1958O","BNLXEU_1958O","Benelux Economic Union","1958-02-03","BEL","1958-02-03","1960-11-01","31.12.9999","Belgium",NA,"706","1958-02-03","1960-07-13","1960-11-01","9999-12-31",NA,"Jael",NA,"0"
"191","BNLXEU_1958O","BNLXEU_1958O","Benelux Economic Union","1958-02-03","LUX","1958-02-03","1960-11-01","31.12.9999","Luxembourg",NA,"706","1958-02-03","1960-08-29","1960-11-01","9999-12-31",NA,"Jael",NA,"0"
"192","BNLXEU_1958O","BNLXEU_1958O","Benelux Economic Union","1958-02-03","NLD","1958-02-03","1960-11-01","31.12.9999","Netherlands",NA,"706","1958-02-03","1960-07-15","1960-11-01","9999-12-31",NA,"Jael",NA,"0"
"193","IND-JPN[NA]_1958O","IND-JPN[NA]_1958O","India Japan","1958-02-04","IND","1958-02-04",NA,"31.12.9999","India","242",NA,"1958-02-04",NA,NA,NA,NA,"Anders",NA,"0"
"194","IND-JPN[NA]_1958O","IND-JPN[NA]_1958O","India Japan","1958-02-04","JPN","1958-02-04",NA,"31.12.9999","Japan","242",NA,"1958-02-04",NA,NA,NA,NA,"Anders",NA,"0"
"195","CNAFTA_1958O","CNAFTA_1958O","Central American Free Trade Area","1958-06-10","CRI","1958-06-10","1959-06-02","31.12.9999","Costa Rica",NA,"189","1959-06-10","1963-09-23",NA,"9999-12-31",NA,"Anders",NA,"0"
"196","CNAFTA_1958O","CNAFTA_1958O","Central American Free Trade Area","1958-06-10","GTM","1958-06-10","1959-06-02","31.12.9999","Guatemala",NA,"189","1959-06-10","1959-06-02",NA,"9999-12-31",NA,"Anders",NA,"0"
"197","CNAFTA_1958O","CNAFTA_1958O","Central American Free Trade Area","1958-06-10","HND","1958-06-10","1959-06-02","31.12.9999","Honduras",NA,"189","1959-06-10","1961-04-05",NA,"9999-12-31",NA,"Anders",NA,"0"
"198","CNAFTA_1958O","CNAFTA_1958O","Central American Free Trade Area","1958-06-10","NIC","1958-06-10","1959-06-02","31.12.9999","Nicaragua",NA,"189","1959-06-10","1959-02-17",NA,"9999-12-31",NA,"Anders",NA,"0"
"199","CNAFTA_1958O","CNAFTA_1958O","Central American Free Trade Area","1958-06-10","SLV","1958-06-10","1959-06-02","31.12.9999","El Salvador",NA,"189","1959-06-10","1959-04-29",NA,"9999-12-31",NA,"Anders",NA,"0"
"200","EQTRCU_1959O","EQTRCU_1959O","Equatorial Customs Union","1959-06-23","CAF","1959-06-23","1962-07-01","08.12.1964","Central African Republic",NA,"422","1959-06-23",NA,"1962-07-01","1964-12-08",NA,"Anders",NA,"0"
"201","EQTRCU_1959O","EQTRCU_1959O","Equatorial Customs Union","1959-06-23","COG","1959-06-23","1962-07-01","08.12.1964","Congo",NA,"422","1959-06-23",NA,"1962-07-01","1964-12-08",NA,"Anders",NA,"0"
"202","EQTRCU_1959O","EQTRCU_1959O","Equatorial Customs Union","1959-06-23","GAB","1959-06-23","1962-07-01","08.12.1964","Gabon",NA,"422","1959-06-23",NA,"1962-07-01","1964-12-08",NA,"Anders",NA,"0"
"203","EQTRCU_1959O","EQTRCU_1959O","Equatorial Customs Union","1959-06-23","TCD","1959-06-23","1962-07-01","08.12.1964","Chad",NA,"422","1959-06-23",NA,"1962-07-01","1964-12-08",NA,"Anders",NA,"0"
"204","EQTRCU_1959O","EQTRCU_1959O","Equatorial Customs Union","1959-06-23","CMR","1959-06-23","1962-07-01","08.12.1964","Cameroon",NA,"422",NA,"1961-06-23","1962-07-01","1964-12-08",NA,"Jael",NA,"0"
"205","EFTA_1960A","EFTA_1960A","EFTA (Stockholm Convention)","1960-01-04","AUT","1960-01-04","1960-03-05","31.12.9999","Austria","177",NA,"1960-01-04",NA,"1960-03-05","1995-01-01",NA,"Anders",NA,"0"
"206","EFTA_1960A","EFTA_1960A","EFTA (Stockholm Convention)","1960-01-04","CHE","1960-01-04","1960-03-05","31.12.9999","Switzerland","177",NA,"1960-01-04",NA,"1960-03-05",NA,NA,"Anders",NA,"0"
"207","EFTA_1960A","EFTA_1960A","EFTA (Stockholm Convention)","1960-01-04","DNK","1960-01-04","1960-03-05","31.12.9999","Denmark","177",NA,"1960-01-04",NA,"1960-03-05","1973-01-01",NA,"Anders",NA,"0"
"208","EFTA_1960A","EFTA_1960A","EFTA (Stockholm Convention)","1960-01-04","GBR","1960-01-04","1960-03-05","31.12.9999","United Kingdom","177",NA,"1960-01-04",NA,"1960-03-05","1973-01-01",NA,"Anders",NA,"0"
"209","EFTA_1960A","EFTA_1960A","EFTA (Stockholm Convention)","1960-01-04","NOR","1960-01-04","1960-03-05","31.12.9999","Norway","177",NA,"1960-01-04",NA,"1960-03-05",NA,NA,"Anders",NA,"0"
"210","EFTA_1960A","EFTA_1960A","EFTA (Stockholm Convention)","1960-01-04","PRT","1960-01-04","1960-03-05","31.12.9999","Portugal","177",NA,"1960-01-04",NA,"1960-03-05","1986-01-01",NA,"Anders",NA,"0"
"211","EFTA_1960A","EFTA_1960A","EFTA (Stockholm Convention)","1960-01-04","SWE","1960-01-04","1960-03-05","31.12.9999","Sweden","177",NA,"1960-01-04",NA,"1960-03-05","1995-01-01",NA,"Anders",NA,"0"
"212","EFTA_1960A","EFTA_1960A","EFTA (Stockholm Convention)","1960-01-04","ISL","1960-01-04","1960-03-05","31.12.9999","Iceland","177",NA,NA,NA,"1970-03-01",NA,NA,"Jael",NA,"0"
"213","EFTA_1960A","EFTA_1960A","EFTA (Stockholm Convention)","1960-01-04","FIN","1960-01-04","1960-03-05","31.12.9999","Finland","177",NA,NA,NA,"1986-01-01","1995-01-01",NA,"Jael",NA,"0"
"214","EFTA_1960A","EFTA_1960A","EFTA (Stockholm Convention)","1960-01-04","LIE","1960-01-04","1960-03-05","31.12.9999","Liechtenstein","177",NA,NA,NA,"1991-09-01",NA,NA,"Jael",NA,"0"
"215","AUS-CAN[NA]_1960O","AUS-CAN[NA]_1960O","Australia Canada","1960-02-12","AUS","1960-02-12","1960-06-30","31.12.9999","Australia",NA,"74","1960-02-12",NA,"1960-06-30","9999-12-31",NA,"Anders",NA,"0"
"216","AUS-CAN[NA]_1960O","AUS-CAN[NA]_1960O","Australia Canada","1960-02-12","CAN","1960-02-12","1960-06-30","31.12.9999","Canada",NA,"74","1960-02-12",NA,"1960-06-30","9999-12-31",NA,"Anders",NA,"0"
"217","LTAFTA_1960O","LTAFTA_1960O","Latin American Free Trade Area (LAFTA)","1960-02-18","ARG","1960-02-18","1962-01-02","12.08.1980","Argentina",NA,"561","1960-02-18",NA,"1962-01-02","1980-08-12",NA,"Anders",NA,"0"
"218","LTAFTA_1960O","LTAFTA_1960O","Latin American Free Trade Area (LAFTA)","1960-02-18","BRA","1960-02-18","1962-01-02","12.08.1980","Brazil",NA,"561","1960-02-18",NA,"1962-01-02","1980-08-12",NA,"Anders",NA,"0"
"219","LTAFTA_1960O","LTAFTA_1960O","Latin American Free Trade Area (LAFTA)","1960-02-18","CHL","1960-02-18","1962-01-02","12.08.1980","Chile",NA,"561","1960-02-18",NA,"1962-01-02","1980-08-12",NA,"Anders",NA,"0"
"220","LTAFTA_1960O","LTAFTA_1960O","Latin American Free Trade Area (LAFTA)","1960-02-18","MEX","1960-02-18","1962-01-02","12.08.1980","Mexico",NA,"561","1960-02-18",NA,"1962-01-02","1980-08-12",NA,"Anders",NA,"1"
"221","LTAFTA_1960O","LTAFTA_1960O","Latin American Free Trade Area (LAFTA)","1960-02-18","PER","1960-02-18","1962-01-02","12.08.1980","Peru",NA,"561","1960-02-18",NA,"1962-01-02","1980-08-12",NA,"Anders",NA,"0"
"222","LTAFTA_1960O","LTAFTA_1960O","Latin American Free Trade Area (LAFTA)","1960-02-18","PRY","1960-02-18","1962-01-02","12.08.1980","Paraguay",NA,"561","1960-02-18",NA,"1962-01-02","1980-08-12",NA,"Anders",NA,"0"
"223","LTAFTA_1960O","LTAFTA_1960O","Latin American Free Trade Area (LAFTA)","1960-02-18","URY","1960-02-18","1962-01-02","12.08.1980","Uruguay",NA,"561","1960-02-18",NA,"1962-01-02","1980-08-12",NA,"Anders",NA,"0"
"224","LTAFTA_1960O","LTAFTA_1960O","Latin American Free Trade Area (LAFTA)","1960-02-18","COL","1960-02-18","1962-01-02","12.08.1980","Colombia",NA,"561",NA,"1961","1962-01-02","1980-08-12",NA,"Jael",NA,"0"
"225","LTAFTA_1960O","LTAFTA_1960O","Latin American Free Trade Area (LAFTA)","1960-02-18","ECU","1960-02-18","1962-01-02","12.08.1980","Ecuador",NA,"561",NA,"1961","1962-01-02","1980-08-12",NA,"Jael",NA,"0"
"226","LTAFTA_1960O","LTAFTA_1960O","Latin American Free Trade Area (LAFTA)","1960-02-18","VEN","1960-02-18","1962-01-02","12.08.1980","Venezuela",NA,"561",NA,"1966-08","1967-09-01","1980-08-12",NA,"Jael","https://publications.gc.ca/Collection-R/LoPBdP/BP/bp372-e.htm","0"
"227","LTAFTA_1960O","LTAFTA_1960O","Latin American Free Trade Area (LAFTA)","1960-02-18","BOL","1960-02-18","1962-01-02","12.08.1980","Bolivia",NA,"561",NA,"1967","1967","1980-08-12",NA,"Jael","https://publications.gc.ca/Collection-R/LoPBdP/BP/bp372-e.htm","0"
"228","CNTACM_1960O","CNTACM_1960O","Central American Common Market (CACM)","1960-12-13","GTM","1960-12-13","1961-06-04","31.12.9999","Guatemala","82","186","1960-12-13","1961-05-05","1961-06-04",NA,"1","Jael","http://rtais.wto.org/UI/PublicShowMemberRTAIDCard.aspx?rtaid=151","0"
"229","CNTACM_1960O","CNTACM_1960O","Central American Common Market (CACM)","1960-12-13","HND","1960-12-13","1961-06-04","31.12.9999","Honduras","82","186","1960-12-13","1962-04-27","1961-06-04",NA,"1","Jael","http://rtais.wto.org/UI/PublicShowMemberRTAIDCard.aspx?rtaid=151","0"
"230","CNTACM_1960O","CNTACM_1960O","Central American Common Market (CACM)","1960-12-13","NIC","1960-12-13","1961-06-04","31.12.9999","Nicaragua","82","186","1960-12-13","1961-05-26","1961-06-04",NA,"1","Jael","http://rtais.wto.org/UI/PublicShowMemberRTAIDCard.aspx?rtaid=151","0"
"231","CNTACM_1960O","CNTACM_1960O","Central American Common Market (CACM)","1960-12-13","SLV","1960-12-13","1961-06-04","31.12.9999","El Salvador","82","186","1960-12-13","1961-05-08","1961-06-04",NA,"1","Jael","http://rtais.wto.org/UI/PublicShowMemberRTAIDCard.aspx?rtaid=151","0"
"232","CNTACM_1960O","CNTACM_1960O","Central American Common Market (CACM)","1960-12-13","CRI","1960-12-13","1961-06-04","31.12.9999","Costa Rica","82","186",NA,"1962-07-23","1963-09-23",NA,NA,"Jael","http://rtais.wto.org/UI/PublicShowMemberRTAIDCard.aspx?rtaid=151","0"
"233","EFTFNL_1961O","EFTFNL_1961O","EFTA Finland","1961-03-27","AUT","1961-03-27","1961","1986","Austria",NA,"445","1961-03-27",NA,NA,"1986",NA,"Jael",NA,"0"
"234","EFTFNL_1961O","EFTFNL_1961O","EFTA Finland","1961-03-27","CHE","1961-03-27","1961","1986","Switzerland",NA,"445","1961-03-27",NA,NA,"1986",NA,"Jael",NA,"0"
"235","EFTFNL_1961O","EFTFNL_1961O","EFTA Finland","1961-03-27","DNK","1961-03-27","1961","1986","Denmark",NA,"445","1961-03-27",NA,NA,"1986",NA,"Jael",NA,"0"
"236","EFTFNL_1961O","EFTFNL_1961O","EFTA Finland","1961-03-27","FIN","1961-03-27","1961","1986","Finland",NA,"445","1961-03-27",NA,NA,"1986",NA,"Jael",NA,"0"
"237","EFTFNL_1961O","EFTFNL_1961O","EFTA Finland","1961-03-27","GBR","1961-03-27","1961","1986","United Kingdom",NA,"445","1961-03-27",NA,NA,"1986",NA,"Jael",NA,"0"
"238","EFTFNL_1961O","EFTFNL_1961O","EFTA Finland","1961-03-27","NOR","1961-03-27","1961","1986","Norway",NA,"445","1961-03-27",NA,NA,"1986",NA,"Jael",NA,"0"
"239","EFTFNL_1961O","EFTFNL_1961O","EFTA Finland","1961-03-27","PRT","1961-03-27","1961","1986","Portugal",NA,"445","1961-03-27",NA,NA,"1986",NA,"Jael",NA,"0"
"240","EFTFNL_1961O","EFTFNL_1961O","EFTA Finland","1961-03-27","SWE","1961-03-27","1961","1986","Sweden",NA,"445","1961-03-27",NA,NA,"1986",NA,"Jael",NA,"0"
"241","BFA-GHA[UVT]_1961A","BFA-GHA[UVT]_1961A","Ghana Upper Volta Trade Agreement","1961-06-28","BFA","1961-06-28",NA,NA,"Burkina Faso",NA,"460","1961-06-28",NA,NA,NA,NA,"Anders",NA,"0"
"242","BFA-GHA[UVT]_1961A","BFA-GHA[UVT]_1961A","Ghana Upper Volta Trade Agreement","1961-06-28","GHA","1961-06-28",NA,NA,"Ghana",NA,"460","1961-06-28",NA,NA,NA,NA,"Anders",NA,"0"
"243","ECGRCA_1961A","ECGRCA_1961A","EEC Greece Association Agreement","1961-07-09","BEL","1961-07-09","1962-11-01","01.01.1981","Belgium",NA,"311","1961-07-09",NA,"1962-11-01","1981-01-01",NA,"Jael",NA,"0"
"244","ECGRCA_1961A","ECGRCA_1961A","EEC Greece Association Agreement","1961-07-09","DEU","1961-07-09","1962-11-01","01.01.1981","Germany",NA,"311","1961-07-09",NA,"1962-11-01","1981-01-01",NA,"Jael",NA,"0"
"245","ECGRCA_1961A","ECGRCA_1961A","EEC Greece Association Agreement","1961-07-09","FRA","1961-07-09","1962-11-01","01.01.1981","France",NA,"311","1961-07-09",NA,"1962-11-01","1981-01-01",NA,"Jael",NA,"0"
"246","ECGRCA_1961A","ECGRCA_1961A","EEC Greece Association Agreement","1961-07-09","GRC","1961-07-09","1962-11-01","01.01.1981","Greece",NA,"311","1961-07-09",NA,"1962-11-01","1981-01-01",NA,"Jael",NA,"0"
"247","ECGRCA_1961A","ECGRCA_1961A","EEC Greece Association Agreement","1961-07-09","ITA","1961-07-09","1962-11-01","01.01.1981","Italy",NA,"311","1961-07-09",NA,"1962-11-01","1981-01-01",NA,"Jael",NA,"0"
"248","ECGRCA_1961A","ECGRCA_1961A","EEC Greece Association Agreement","1961-07-09","LUX","1961-07-09","1962-11-01","01.01.1981","Luxembourg",NA,"311","1961-07-09",NA,"1962-11-01","1981-01-01",NA,"Jael",NA,"0"
"249","ECGRCA_1961A","ECGRCA_1961A","EEC Greece Association Agreement","1961-07-09","NLD","1961-07-09","1962-11-01","01.01.1981","Netherlands",NA,"311","1961-07-09",NA,"1962-11-01","1981-01-01",NA,"Jael",NA,"0"
"250","ECGRCA_1961A","ECGRCA_1961A","EEC Greece Association Agreement","1961-07-09","DNK","1961-07-09","1962-11-01","01.01.1981","Denmark",NA,"311","1975-04-28",NA,"1978-07-01","1981-01-01",NA,"Jael","https://eur-lex.europa.eu/legal-content/EN/ALL/?uri=CELEX:21978A0428(01)&qid=1703188557640","0"
"251","ECGRCA_1961A","ECGRCA_1961A","EEC Greece Association Agreement","1961-07-09","GBR","1961-07-09","1962-11-01","01.01.1981","United Kingdom",NA,"311","1975-04-28",NA,"1978-07-01","1981-01-01",NA,"Jael","https://eur-lex.europa.eu/legal-content/EN/ALL/?uri=CELEX:21978A0428(01)&qid=1703188557640","0"
"252","ECGRCA_1961A","ECGRCA_1961A","EEC Greece Association Agreement","1961-07-09","IRL","1961-07-09","1962-11-01","01.01.1981","Ireland",NA,"311","1975-04-28",NA,"1978-07-01","1981-01-01",NA,"Jael","https://eur-lex.europa.eu/legal-content/EN/ALL/?uri=CELEX:21978A0428(01)&qid=1703188557640","0"
"253","AFRCCM_1962O","AFRCCM_1962O","African Common Market","1962-04-01","DZA","1962-04-01","1963-07-01",NA,"Algeria",NA,"2","1962-04-01",NA,NA,NA,NA,"Anders",NA,"0"
"254","AFRCCM_1962O","AFRCCM_1962O","African Common Market","1962-04-01","EGY","1962-04-01","1963-07-01",NA,"Egypt",NA,"2","1962-04-01",NA,NA,NA,NA,"Anders",NA,"0"
"255","AFRCCM_1962O","AFRCCM_1962O","African Common Market","1962-04-01","GHA","1962-04-01","1963-07-01",NA,"Ghana",NA,"2","1962-04-01",NA,NA,NA,NA,"Anders",NA,"0"
"256","AFRCCM_1962O","AFRCCM_1962O","African Common Market","1962-04-01","GIN","1962-04-01","1963-07-01",NA,"Guinea",NA,"2","1962-04-01",NA,NA,NA,NA,"Anders",NA,"0"
"257","AFRCCM_1962O","AFRCCM_1962O","African Common Market","1962-04-01","MAR","1962-04-01","1963-07-01",NA,"Morocco",NA,"2","1962-04-01",NA,NA,NA,NA,"Anders",NA,"0"
"258","AFRCCM_1962O","AFRCCM_1962O","African Common Market","1962-04-01","MLI","1962-04-01","1963-07-01",NA,"Mali",NA,"2","1962-04-01",NA,NA,NA,NA,"Anders",NA,"0"
"259","JOR-SAU[SDA]_1962O","JOR-SAU[SDA]_1962O","Jordan Saudi Arabia","1962-10-30","JOR","1962-10-30","1962-10-30",NA,"Jordan",NA,"533","1962-10-30",NA,NA,NA,NA,"Jael","https://leap.unep.org/en/countries/jo/national-legislation/bilateral-economic-agreement-between-jordan-and-saudi-arabia","0"
"260","JOR-SAU[SDA]_1962O","JOR-SAU[SDA]_1962O","Jordan Saudi Arabia","1962-10-30","SAU","1962-10-30","1962-10-30",NA,"Saudi Arabia",NA,"533","1962-10-30",NA,NA,NA,NA,"Jael","https://leap.unep.org/en/countries/jo/national-legislation/bilateral-economic-agreement-between-jordan-and-saudi-arabia","0"
"261","FRA-MCO[NA]_1963O","FRA-MCO[NA]_1963O","France Monaco","1963-05-18","FRA","1963-05-18","1963-09-01","31.12.9999","France",NA,"452","1963-05-18",NA,"1963-09-01","9999-12-31",NA,"Anders",NA,"0"
"262","FRA-MCO[NA]_1963O","FRA-MCO[NA]_1963O","France Monaco","1963-05-18","MCO","1963-05-18","1963-09-01","31.12.9999","Monaco",NA,"452","1963-05-18",NA,"1963-09-01","9999-12-31",NA,"Anders",NA,"0"
"263","YAOUND_1963O1","YAOUND_1963O1","Yaounde 1","1963-07-20","BDI","1963-07-20","1964-01-01","01.01.1971","Burundi",NA,"689","1963-07-20",NA,NA,"1971-01-01",NA,"Anders",NA,"0"
"264","YAOUND_1963O1","YAOUND_1963O1","Yaounde 1","1963-07-20","BEL","1963-07-20","1964-01-01","01.01.1971","Belgium",NA,"689","1963-07-20",NA,NA,"1971-01-01",NA,"Anders",NA,"0"
"265","YAOUND_1963O1","YAOUND_1963O1","Yaounde 1","1963-07-20","BEN","1963-07-20","1964-01-01","01.01.1971","Benin",NA,"689","1963-07-20",NA,NA,"1971-01-01",NA,"Anders",NA,"0"
"266","YAOUND_1963O1","YAOUND_1963O1","Yaounde 1","1963-07-20","BFA","1963-07-20","1964-01-01","01.01.1971","Burkina Faso",NA,"689","1963-07-20",NA,NA,"1971-01-01",NA,"Anders",NA,"0"
"267","YAOUND_1963O1","YAOUND_1963O1","Yaounde 1","1963-07-20","CAF","1963-07-20","1964-01-01","01.01.1971","Central African Republic",NA,"689","1963-07-20",NA,NA,"1971-01-01",NA,"Anders",NA,"0"
"268","YAOUND_1963O1","YAOUND_1963O1","Yaounde 1","1963-07-20","CIV","1963-07-20","1964-01-01","01.01.1971","Cote dIvoire",NA,"689","1963-07-20",NA,NA,"1971-01-01",NA,"Anders",NA,"0"
"269","YAOUND_1963O1","YAOUND_1963O1","Yaounde 1","1963-07-20","CMR","1963-07-20","1964-01-01","01.01.1971","Cameroon",NA,"689","1963-07-20",NA,NA,"1971-01-01",NA,"Anders",NA,"0"
"270","YAOUND_1963O1","YAOUND_1963O1","Yaounde 1","1963-07-20","COD","1963-07-20","1964-01-01","01.01.1971","Democratic Republic of the Congo",NA,"689","1963-07-20",NA,NA,"1971-01-01",NA,"Anders",NA,"0"
"271","YAOUND_1963O1","YAOUND_1963O1","Yaounde 1","1963-07-20","COG","1963-07-20","1964-01-01","01.01.1971","Republic of the Congo",NA,"689","1963-07-20",NA,NA,"1971-01-01",NA,"Anders",NA,"0"
"272","YAOUND_1963O1","YAOUND_1963O1","Yaounde 1","1963-07-20","DEU","1963-07-20","1964-01-01","01.01.1971","Germany",NA,"689","1963-07-20",NA,NA,"1971-01-01",NA,"Anders",NA,"0"
"273","YAOUND_1963O1","YAOUND_1963O1","Yaounde 1","1963-07-20","FRA","1963-07-20","1964-01-01","01.01.1971","France",NA,"689","1963-07-20",NA,NA,"1971-01-01",NA,"Anders",NA,"0"
"274","YAOUND_1963O1","YAOUND_1963O1","Yaounde 1","1963-07-20","GAB","1963-07-20","1964-01-01","01.01.1971","Gabon",NA,"689","1963-07-20",NA,NA,"1971-01-01",NA,"Anders",NA,"0"
"275","YAOUND_1963O1","YAOUND_1963O1","Yaounde 1","1963-07-20","ITA","1963-07-20","1964-01-01","01.01.1971","Italy",NA,"689","1963-07-20",NA,NA,"1971-01-01",NA,"Anders",NA,"0"
"276","YAOUND_1963O1","YAOUND_1963O1","Yaounde 1","1963-07-20","LUX","1963-07-20","1964-01-01","01.01.1971","Luxembourg",NA,"689","1963-07-20",NA,NA,"1971-01-01",NA,"Anders",NA,"0"
"277","YAOUND_1963O1","YAOUND_1963O1","Yaounde 1","1963-07-20","MDG","1963-07-20","1964-01-01","01.01.1971","Madagascar",NA,"689","1963-07-20",NA,NA,"1971-01-01",NA,"Anders",NA,"0"
"278","YAOUND_1963O1","YAOUND_1963O1","Yaounde 1","1963-07-20","MLI","1963-07-20","1964-01-01","01.01.1971","Mali",NA,"689","1963-07-20",NA,NA,"1971-01-01",NA,"Anders",NA,"0"
"279","YAOUND_1963O1","YAOUND_1963O1","Yaounde 1","1963-07-20","MRT","1963-07-20","1964-01-01","01.01.1971","Mauritania",NA,"689","1963-07-20",NA,NA,"1971-01-01",NA,"Anders",NA,"0"
"280","YAOUND_1963O1","YAOUND_1963O1","Yaounde 1","1963-07-20","NER","1963-07-20","1964-01-01","01.01.1971","Niger",NA,"689","1963-07-20",NA,NA,"1971-01-01",NA,"Anders",NA,"0"
"281","YAOUND_1963O1","YAOUND_1963O1","Yaounde 1","1963-07-20","NLD","1963-07-20","1964-01-01","01.01.1971","Netherlands",NA,"689","1963-07-20",NA,NA,"1971-01-01",NA,"Anders",NA,"0"
"282","YAOUND_1963O1","YAOUND_1963O1","Yaounde 1","1963-07-20","RWA","1963-07-20","1964-01-01","01.01.1971","Rwanda",NA,"689","1963-07-20",NA,NA,"1971-01-01",NA,"Anders",NA,"0"
"283","YAOUND_1963O1","YAOUND_1963O1","Yaounde 1","1963-07-20","SEN","1963-07-20","1964-01-01","01.01.1971","Senegal",NA,"689","1963-07-20",NA,NA,"1971-01-01",NA,"Anders",NA,"0"
"284","YAOUND_1963O1","YAOUND_1963O1","Yaounde 1","1963-07-20","SOM","1963-07-20","1964-01-01","01.01.1971","Somalia",NA,"689","1963-07-20",NA,NA,"1971-01-01",NA,"Anders",NA,"0"
"285","YAOUND_1963O1","YAOUND_1963O1","Yaounde 1","1963-07-20","TCD","1963-07-20","1964-01-01","01.01.1971","Chad",NA,"689","1963-07-20",NA,NA,"1971-01-01",NA,"Anders",NA,"0"
"286","YAOUND_1963O1","YAOUND_1963O1","Yaounde 1","1963-07-20","TGO","1963-07-20","1964-01-01","01.01.1971","Togo",NA,"689","1963-07-20",NA,NA,"1971-01-01",NA,"Anders",NA,"0"
"287","ECTRKA_1963A","ECTRKA_1963A","EC Turkey Association Agreement (Ankara Agreement)","1963-09-12","BEL","1963-09-12","1964-12-01","31.12.9999","Belgium",NA,"357","1963-09-12","1964-10-28","1964-12-01","9999-12-31",NA,"Anders",NA,"0"
"288","ECTRKA_1963A","ECTRKA_1963A","EC Turkey Association Agreement (Ankara Agreement)","1963-09-12","DEU","1963-09-12","1964-12-01","31.12.9999","Germany",NA,"357","1963-09-12","1964-10-28","1964-12-01","9999-12-31",NA,"Anders",NA,"0"
"289","ECTRKA_1963A","ECTRKA_1963A","EC Turkey Association Agreement (Ankara Agreement)","1963-09-12","FRA","1963-09-12","1964-12-01","31.12.9999","France",NA,"357","1963-09-12","1964-10-28","1964-12-01","9999-12-31",NA,"Anders",NA,"0"
"290","ECTRKA_1963A","ECTRKA_1963A","EC Turkey Association Agreement (Ankara Agreement)","1963-09-12","ITA","1963-09-12","1964-12-01","31.12.9999","Italy",NA,"357","1963-09-12","1964-10-28","1964-12-01","9999-12-31",NA,"Anders",NA,"0"
"291","ECTRKA_1963A","ECTRKA_1963A","EC Turkey Association Agreement (Ankara Agreement)","1963-09-12","LUX","1963-09-12","1964-12-01","31.12.9999","Luxembourg",NA,"357","1963-09-12","1964-10-28","1964-12-01","9999-12-31",NA,"Anders",NA,"0"
"292","ECTRKA_1963A","ECTRKA_1963A","EC Turkey Association Agreement (Ankara Agreement)","1963-09-12","NLD","1963-09-12","1964-12-01","31.12.9999","Netherlands",NA,"357","1963-09-12","1964-10-28","1964-12-01","9999-12-31",NA,"Anders",NA,"0"
"293","ECTRKA_1963A","ECTRKA_1963A","EC Turkey Association Agreement (Ankara Agreement)","1963-09-12","TUR","1963-09-12","1964-12-01","31.12.9999","Turkey",NA,"357","1963-09-12","1964-10-28","1964-12-01","9999-12-31",NA,"Anders",NA,"0"
"294","ECTRKA_1963A","ECTRKA_1963A","EC Turkey Association Agreement (Ankara Agreement)","1963-09-12","DNK","1963-09-12","1964-12-01","31.12.9999","Denmark",NA,"357","1973-06-30",NA,"1986-03-01","9999-12-31",NA,"Jael","https://eur-lex.europa.eu/legal-content/EN/TXT/?uri=CELEX%3A21973A0630%2801%29&qid=1703188355297","0"
"295","ECTRKA_1963A","ECTRKA_1963A","EC Turkey Association Agreement (Ankara Agreement)","1963-09-12","GBR","1963-09-12","1964-12-01","31.12.9999","United Kingdom",NA,"357","1973-06-30",NA,"1986-03-01","2020-02-01",NA,"Jael","https://eur-lex.europa.eu/legal-content/EN/TXT/?uri=CELEX%3A21973A0630%2801%29&qid=1703188355297","0"
"296","ECTRKA_1963A","ECTRKA_1963A","EC Turkey Association Agreement (Ankara Agreement)","1963-09-12","IRL","1963-09-12","1964-12-01","31.12.9999","Ireland",NA,"357","1973-06-30",NA,"1986-03-01","9999-12-31",NA,"Jael","https://eur-lex.europa.eu/legal-content/EN/TXT/?uri=CELEX%3A21973A0630%2801%29&qid=1703188355297","0"
"297","ECTRKA_1963A","ECTRKA_1963A","EC Turkey Association Agreement (Ankara Agreement)","1963-09-12","ESP","1963-09-12","1964-12-01","31.12.9999","Spain",NA,"357",NA,NA,"1987-07-23","9999-12-31",NA,"Jael",NA,"0"
"298","ECTRKA_1963A","ECTRKA_1963A","EC Turkey Association Agreement (Ankara Agreement)","1963-09-12","PRT","1963-09-12","1964-12-01","31.12.9999","Portugal",NA,"357",NA,NA,"1987-07-23","9999-12-31",NA,"Jael",NA,"0"
"299","ECTRKA_1963A","ECTRKA_1963A","EC Turkey Association Agreement (Ankara Agreement)","1963-09-12","AUT","1963-09-12","1964-12-01","31.12.9999","Austria",NA,"357",NA,NA,"1995-01-01","9999-12-31",NA,"Jael",NA,"0"
"300","ECTRKA_1963A","ECTRKA_1963A","EC Turkey Association Agreement (Ankara Agreement)","1963-09-12","FIN","1963-09-12","1964-12-01","31.12.9999","Finland",NA,"357",NA,NA,"1995-01-01","9999-12-31",NA,"Jael",NA,"0"
"301","ECTRKA_1963A","ECTRKA_1963A","EC Turkey Association Agreement (Ankara Agreement)","1963-09-12","SWE","1963-09-12","1964-12-01","31.12.9999","Sweden",NA,"357",NA,NA,"1995-01-01","9999-12-31",NA,"Jael",NA,"0"
"302","ECTRKA_1963A","ECTRKA_1963A","EC Turkey Association Agreement (Ankara Agreement)","1963-09-12","CYP","1963-09-12","1964-12-01","31.12.9999","Cyprus",NA,"357","2005-07-29",NA,"2004-05-01","9999-12-31",NA,"Jael","https://eur-lex.europa.eu/legal-content/EN/TXT/?uri=CELEX%3A22005A0930%2801%29&qid=1703188355297","0"
"303","ECTRKA_1963A","ECTRKA_1963A","EC Turkey Association Agreement (Ankara Agreement)","1963-09-12","CZE","1963-09-12","1964-12-01","31.12.9999","Czech Republic",NA,"357","2005-07-29",NA,"2004-05-01","9999-12-31",NA,"Jael","https://eur-lex.europa.eu/legal-content/EN/TXT/?uri=CELEX%3A22005A0930%2801%29&qid=1703188355297","1"
"304","ECTRKA_1963A","ECTRKA_1963A","EC Turkey Association Agreement (Ankara Agreement)","1963-09-12","EST","1963-09-12","1964-12-01","31.12.9999","Estonia",NA,"357","2005-07-29",NA,"2004-05-01","9999-12-31",NA,"Jael","https://eur-lex.europa.eu/legal-content/EN/TXT/?uri=CELEX%3A22005A0930%2801%29&qid=1703188355297","1"
"305","ECTRKA_1963A","ECTRKA_1963A","EC Turkey Association Agreement (Ankara Agreement)","1963-09-12","HUN","1963-09-12","1964-12-01","31.12.9999","Hungary",NA,"357","2005-07-29",NA,"2004-05-01","9999-12-31",NA,"Jael","https://eur-lex.europa.eu/legal-content/EN/TXT/?uri=CELEX%3A22005A0930%2801%29&qid=1703188355297","0"
"306","ECTRKA_1963A","ECTRKA_1963A","EC Turkey Association Agreement (Ankara Agreement)","1963-09-12","LTU","1963-09-12","1964-12-01","31.12.9999","Lithuania",NA,"357","2005-07-29",NA,"2004-05-01","9999-12-31",NA,"Jael","https://eur-lex.europa.eu/legal-content/EN/TXT/?uri=CELEX%3A22005A0930%2801%29&qid=1703188355297","1"
"307","ECTRKA_1963A","ECTRKA_1963A","EC Turkey Association Agreement (Ankara Agreement)","1963-09-12","LVA","1963-09-12","1964-12-01","31.12.9999","Latvia",NA,"357","2005-07-29",NA,"2004-05-01","9999-12-31",NA,"Jael","https://eur-lex.europa.eu/legal-content/EN/TXT/?uri=CELEX%3A22005A0930%2801%29&qid=1703188355297","1"
"308","ECTRKA_1963A","ECTRKA_1963A","EC Turkey Association Agreement (Ankara Agreement)","1963-09-12","MLT","1963-09-12","1964-12-01","31.12.9999","Malta",NA,"357","2005-07-29",NA,"2004-05-01","9999-12-31",NA,"Jael","https://eur-lex.europa.eu/legal-content/EN/TXT/?uri=CELEX%3A22005A0930%2801%29&qid=1703188355297","0"
"309","ECTRKA_1963A","ECTRKA_1963A","EC Turkey Association Agreement (Ankara Agreement)","1963-09-12","POL","1963-09-12","1964-12-01","31.12.9999","Poland",NA,"357","2005-07-29",NA,"2004-05-01","9999-12-31",NA,"Jael","https://eur-lex.europa.eu/legal-content/EN/TXT/?uri=CELEX%3A22005A0930%2801%29&qid=1703188355297","0"
"310","ECTRKA_1963A","ECTRKA_1963A","EC Turkey Association Agreement (Ankara Agreement)","1963-09-12","SVK","1963-09-12","1964-12-01","31.12.9999","Slovakia",NA,"357","2005-07-29",NA,"2004-05-01","9999-12-31",NA,"Jael","https://eur-lex.europa.eu/legal-content/EN/TXT/?uri=CELEX%3A22005A0930%2801%29&qid=1703188355297","1"
"311","ECTRKA_1963A","ECTRKA_1963A","EC Turkey Association Agreement (Ankara Agreement)","1963-09-12","SVN","1963-09-12","1964-12-01","31.12.9999","Slovenia",NA,"357","2005-07-29",NA,"2004-05-01","9999-12-31",NA,"Jael","https://eur-lex.europa.eu/legal-content/EN/TXT/?uri=CELEX%3A22005A0930%2801%29&qid=1703188355297","1"
"312","ECTRKA_1963A","ECTRKA_1963A","EC Turkey Association Agreement (Ankara Agreement)","1963-09-12","BGR","1963-09-12","1964-12-01","31.12.9999","Bulgaria",NA,"357",NA,NA,"2007-01-01","9999-12-31",NA,"Jael",NA,"0"
"313","ECTRKA_1963A","ECTRKA_1963A","EC Turkey Association Agreement (Ankara Agreement)","1963-09-12","ROU","1963-09-12","1964-12-01","31.12.9999","Romania",NA,"357",NA,NA,"2007-01-01","9999-12-31",NA,"Jael",NA,"0"
"314","ECTRKA_1963A","ECTRKA_1963A","EC Turkey Association Agreement (Ankara Agreement)","1963-09-12","HRV","1963-09-12","1964-12-01","31.12.9999","Croatia",NA,"357",NA,NA,"2013-07-01","9999-12-31",NA,"Jael",NA,"1"
"315","ARBCMM_1962O","ARBCMM_1962O","Arab Common Market","1964-08-13","EGY","1964-08-13","1965-01-01",NA,"Egypt",NA,"29","1964-08-13",NA,"1965-01-01","1979",NA,"Jael","https://uia.org/s/or/en/1100064203","0"
"316","ARBCMM_1962O","ARBCMM_1962O","Arab Common Market","1964-08-13","IRQ","1964-08-13","1965-01-01",NA,"Iraq",NA,"29","1964-08-13",NA,"1965-01-01",NA,NA,"Jael","https://uia.org/s/or/en/1100064203","0"
"317","ARBCMM_1962O","ARBCMM_1962O","Arab Common Market","1964-08-13","JOR","1964-08-13","1965-01-01",NA,"Jordan",NA,"29","1964-08-13",NA,"1965-01-01",NA,NA,"Jael","https://uia.org/s/or/en/1100064203","0"
"318","ARBCMM_1962O","ARBCMM_1962O","Arab Common Market","1964-08-13","SYR","1964-08-13","1965-01-01",NA,"Syria",NA,"29","1964-08-13",NA,"1965-01-01",NA,NA,"Jael","https://uia.org/s/or/en/1100064203","0"
"319","ARBCMM_1962O","ARBCMM_1962O","Arab Common Market","1964-08-13","LBY","1964-08-13","1965-01-01",NA,"Libya",NA,"29",NA,NA,"1975",NA,NA,"Jael","https://uia.org/s/or/en/1100064203","0"
"320","ARBCMM_1962O","ARBCMM_1962O","Arab Common Market","1964-08-13","MRT","1964-08-13","1965-01-01",NA,"Mauritania",NA,"29",NA,NA,"1980",NA,NA,"Jael","https://uia.org/s/or/en/1100064203","0"
"321","ARBCMM_1962O","ARBCMM_1962O","Arab Common Market","1964-08-13","YEM","1964-08-13","1965-01-01",NA,"Yemen",NA,"29",NA,NA,"1981",NA,NA,"Jael","https://uia.org/s/or/en/1100064203","0"
"322","ZAF-ZWE[NA]_1964O","ZAF-ZWE[NA]_1964O","South Africa Zimbabwe","1964-11-30","ZAF","1964-11-30","1964-12-01","31.12.9999","South Africa",NA,"664","1964-11-30",NA,"1964-12-01","9999-12-31",NA,"Jael",NA,"0"
"323","ZAF-ZWE[NA]_1964O","ZAF-ZWE[NA]_1964O","South Africa Zimbabwe","1964-11-30","ZWE","1964-11-30","1964-12-01","31.12.9999","Zimbabwe",NA,"664","1964-11-30",NA,"1964-12-01","9999-12-31",NA,"Jael",NA,"0"
"324","CNACEU_1964O","CNACEU_1964O","Central African Customs And Economic Union (UDEAC)","1964-12-08","CAF","1964-12-08","1966-01-01","01.01.1998","Central African Republic",NA,"182","1964-12-08",NA,NA,"1998-01-01",NA,"Jael",NA,"0"
"325","CNACEU_1964O","CNACEU_1964O","Central African Customs And Economic Union (UDEAC)","1964-12-08","CMR","1964-12-08","1966-01-01","01.01.1998","Cameroon",NA,"182","1964-12-08",NA,NA,"1998-01-01",NA,"Jael",NA,"0"
"326","CNACEU_1964O","CNACEU_1964O","Central African Customs And Economic Union (UDEAC)","1964-12-08","COG","1964-12-08","1966-01-01","01.01.1998","Congo",NA,"182","1964-12-08",NA,NA,"1998-01-01",NA,"Jael",NA,"0"
"327","CNACEU_1964O","CNACEU_1964O","Central African Customs And Economic Union (UDEAC)","1964-12-08","GAB","1964-12-08","1966-01-01","01.01.1998","Gabon",NA,"182","1964-12-08",NA,NA,"1998-01-01",NA,"Jael",NA,"0"
"328","CNACEU_1964O","CNACEU_1964O","Central African Customs And Economic Union (UDEAC)","1964-12-08","TCD","1964-12-08","1966-01-01","01.01.1998","Chad",NA,"182","1964-12-08",NA,NA,"1998-01-01",NA,"Jael",NA,"0"
"329","CAN-USA[APT]_1965A","CAN-USA[APT]_1965A","Canada US Automotive Products Trade Agreement (APTA)","1965-01-16","CAN","1965-01-16","1966-01-01","19.02.2001","Canada",NA,"170","1965-01-16",NA,NA,"2001-02-19",NA,"Anders",NA,"0"
"330","CAN-USA[APT]_1965A","CAN-USA[APT]_1965A","Canada US Automotive Products Trade Agreement (APTA)","1965-01-16","USA","1965-01-16","1966-01-01","19.02.2001","United States",NA,"170","1965-01-16",NA,NA,"2001-02-19",NA,"Anders",NA,"0"
"331","AUS-NZL[FRT]_1965A","AUS-NZL[FRT]_1965A","Australia New Zealand Free Trade Agreement","1965-08-31","AUS","1965-08-31","1966-01-01","01.01.1983","Australia",NA,"79","1965-08-31",NA,"1966-01-01","1983-01-01",NA,"Anders",NA,"0"
"332","AUS-NZL[FRT]_1965A","AUS-NZL[FRT]_1965A","Australia New Zealand Free Trade Agreement","1965-08-31","NZL","1965-08-31","1966-01-01","01.01.1983","New Zealand",NA,"79","1965-08-31",NA,"1966-01-01","1983-01-01",NA,"Anders",NA,"0"
"333","CRBFTA_1965O","CRBFTA_1965O","Caribbean Free Trade Association (CARIFTA)","1965-12-15","ATG","1965-12-15","1968-05-01","01.08.1973","Antigua and Barbuda",NA,"180","1966-12-10",NA,"1968-05-01","1973-08-01",NA,"Jael",NA,"0"
"334","CRBFTA_1965O","CRBFTA_1965O","Caribbean Free Trade Association (CARIFTA)","1965-12-15","BRB","1965-12-15","1968-05-01","01.08.1973","Barbados",NA,"180","1966-12-10",NA,"1968-05-01","1973-08-01",NA,"Jael",NA,"0"
"335","CRBFTA_1965O","CRBFTA_1965O","Caribbean Free Trade Association (CARIFTA)","1965-12-15","DMA","1965-12-15","1968-05-01","01.08.1973","Dominica",NA,"180",NA,NA,"1968-07-01","1973-08-01",NA,"Jael",NA,"0"
"336","CRBFTA_1965O","CRBFTA_1965O","Caribbean Free Trade Association (CARIFTA)","1965-12-15","GRD","1965-12-15","1968-05-01","01.08.1973","Grenada",NA,"180",NA,NA,"1968-07-01","1973-08-01",NA,"Jael",NA,"0"
"337","CRBFTA_1965O","CRBFTA_1965O","Caribbean Free Trade Association (CARIFTA)","1965-12-15","GUY","1965-12-15","1968-05-01","01.08.1973","Guyana",NA,"180","1966-12-10",NA,"1968-05-01","1973-08-01",NA,"Jael",NA,"0"
"338","CRBFTA_1965O","CRBFTA_1965O","Caribbean Free Trade Association (CARIFTA)","1965-12-15","JAM","1965-12-15","1968-05-01","01.08.1973","Jamaica",NA,"180",NA,NA,"1968-08-01","1973-08-01",NA,"Jael",NA,"0"
"339","CRBFTA_1965O","CRBFTA_1965O","Caribbean Free Trade Association (CARIFTA)","1965-12-15","KNA","1965-12-15","1968-05-01","01.08.1973","St. Kitts and Nevis",NA,"180",NA,NA,"1968-07-01","1973-08-01",NA,"Jael",NA,"0"
"340","CRBFTA_1965O","CRBFTA_1965O","Caribbean Free Trade Association (CARIFTA)","1965-12-15","LCA","1965-12-15","1968-05-01","01.08.1973","St. Lucia",NA,"180",NA,NA,"1968-07-01","1973-08-01",NA,"Jael",NA,"0"
"341","CRBFTA_1965O","CRBFTA_1965O","Caribbean Free Trade Association (CARIFTA)","1965-12-15","MSR","1965-12-15","1968-05-01","01.08.1973","Montserrat",NA,"180",NA,NA,"1968-08-01","1973-08-01",NA,"Jael",NA,"0"
"342","CRBFTA_1965O","CRBFTA_1965O","Caribbean Free Trade Association (CARIFTA)","1965-12-15","VCT","1965-12-15","1968-05-01","01.08.1973","St. Vincent and Grenadines",NA,"180",NA,NA,"1968-07-01","1973-08-01",NA,"Jael",NA,"0"
"343","CRBFTA_1965O","CRBFTA_1965O","Caribbean Free Trade Association (CARIFTA)","1965-12-15","TTO","1965-12-15","1968-05-01","01.08.1973","Trinidad and Tobago",NA,"180",NA,NA,"1968-05-01","1973-08-01",NA,"Jael",NA,"0"
"344","CRBFTA_1965O","CRBFTA_1965O","Caribbean Free Trade Association (CARIFTA)","1965-12-15","BLZ","1965-12-15","1968-05-01","01.08.1973","Belize",NA,"180",NA,NA,"1971-05","1973-08-01",NA,"Jael",NA,"0"
"345","GBR-IRL[FTA]_1965O","GBR-IRL[FTA]_1965O","Ireland UK Free Trade Area","1965-12-15","GBR","1965-12-15","1966-07-01","31.12.9999","United Kingdom",NA,"505","1965-12-15",NA,"1966-07-01","9999-12-31",NA,"Jael",NA,"0"
"346","GBR-IRL[FTA]_1965O","GBR-IRL[FTA]_1965O","Ireland UK Free Trade Area","1965-12-15","IRL","1965-12-15","1966-07-01","31.12.9999","Ireland",NA,"505","1965-12-15",NA,"1966-07-01","9999-12-31",NA,"Jael",NA,"0"
"347","ESTAFC_1966O","ESTAFC_1966O","East African Community (EAC)","1966","KEN","1966","1967-12-01","1977","Kenya",NA,"901",NA,NA,"1967",NA,NA,"Anders","https://www.elibrary.imf.org/view/journals/022/0016/004/article-A010-en.xml","0"
"348","ESTAFC_1966O","ESTAFC_1966O","East African Community (EAC)","1966","TZA","1966","1967-12-01","1977","Tanzania",NA,"901",NA,NA,"1967",NA,NA,"Anders","https://www.elibrary.imf.org/view/journals/022/0016/004/article-A010-en.xml","0"
"349","ESTAFC_1966O","ESTAFC_1966O","East African Community (EAC)","1966","UGA","1966","1967-12-01","1977","Uganda",NA,"901",NA,NA,"1967",NA,NA,"Anders","https://www.elibrary.imf.org/view/journals/022/0016/004/article-A010-en.xml","0"
"350","MWI-ZAF[NA]_1967A","MWI-ZAF[NA]_1967A","Malawi South Africa","1967-01-01","MWI","1967-01-01","1967-03-13",NA,"Malawi",NA,"596","1967-03-13",NA,"1967-04-01",NA,NA,"Anders",NA,"0"
"351","MWI-ZAF[NA]_1967A","MWI-ZAF[NA]_1967A","Malawi South Africa","1967-01-01","ZAF","1967-01-01","1967-03-13",NA,"South Africa",NA,"596","1967-03-13",NA,"1967-04-01",NA,NA,"Anders",NA,"0"
"352","TRPRTT_1967A","TRPRTT_1967A","Tripartite Agreement","1967-12-23","EGY","1967-12-23","1968-04-01",NA,"Egypt",NA,"682","1967-12-23",NA,"1968-04-01",NA,NA,"Anders",NA,"0"
"353","TRPRTT_1967A","TRPRTT_1967A","Tripartite Agreement","1967-12-23","IND","1967-12-23","1968-04-01",NA,"India",NA,"682","1967-12-23",NA,"1968-04-01",NA,NA,"Anders",NA,"0"
"354","TRPRTT_1967A","TRPRTT_1967A","Tripartite Agreement","1967-12-23","SRB","1967-12-23","1968-04-01",NA,"Serbia",NA,"682","1967-12-23",NA,"1968-04-01",NA,NA,"Anders",NA,"1"
"355","ESTCCM_1968O","ESTCCM_1968O","East Caribbean Common Market","1968-06-01","ATG","1968-06-01","1968-07-01","21.01.2011","Antigua and Barbuda",NA,"788","1968-06-01",NA,"1968-07-01","2011-01-21",NA,"Jael",NA,"0"
"356","ESTCCM_1968O","ESTCCM_1968O","East Caribbean Common Market","1968-06-01","DMA","1968-06-01","1968-07-01","21.01.2011","Dominica",NA,"788","1968-06-01",NA,"1968-07-01","2011-01-21",NA,"Jael",NA,"0"
"357","ESTCCM_1968O","ESTCCM_1968O","East Caribbean Common Market","1968-06-01","GRD","1968-06-01","1968-07-01","21.01.2011","Grenada",NA,"788","1968-06-01",NA,"1968-07-01","2011-01-21",NA,"Jael",NA,"0"
"358","ESTCCM_1968O","ESTCCM_1968O","East Caribbean Common Market","1968-06-01","KNA","1968-06-01","1968-07-01","21.01.2011","St. Kitts and Nevis",NA,"788","1968-06-01",NA,"1968-07-01","2011-01-21",NA,"Jael",NA,"0"
"359","ESTCCM_1968O","ESTCCM_1968O","East Caribbean Common Market","1968-06-01","LCA","1968-06-01","1968-07-01","21.01.2011","St. Lucia",NA,"788","1968-06-01",NA,"1968-07-01","2011-01-21",NA,"Jael",NA,"0"
"360","ESTCCM_1968O","ESTCCM_1968O","East Caribbean Common Market","1968-06-01","MSR","1968-06-01","1968-07-01","21.01.2011","Montserrat",NA,"788","1968-06-01",NA,"1968-07-01","2011-01-21",NA,"Jael",NA,"0"
"361","ESTCCM_1968O","ESTCCM_1968O","East Caribbean Common Market","1968-06-01","VCT","1968-06-01","1968-07-01","21.01.2011","St. Vincent and Grenadines",NA,"788","1968-06-01",NA,"1968-07-01","2011-01-21",NA,"Jael",NA,"0"
"362","ARUSHA_1968A","ARUSHA_1968A","Arusha Agreement 1","1968-07-26","BEL","1968-07-26",NA,NA,"Belgium",NA,"700","1968-07-26",NA,NA,NA,NA,"Jael","https://www.europarl.europa.eu/pdf/cardoc/CAHIER_SPECIAL_2011-WEBEN.pdf","0"
"363","ARUSHA_1968A","ARUSHA_1968A","Arusha Agreement 1","1968-07-26","DEU","1968-07-26",NA,NA,"Germany",NA,"700","1968-07-26",NA,NA,NA,NA,"Jael","https://www.europarl.europa.eu/pdf/cardoc/CAHIER_SPECIAL_2011-WEBEN.pdf","0"
"364","ARUSHA_1968A","ARUSHA_1968A","Arusha Agreement 1","1968-07-26","FRA","1968-07-26",NA,NA,"France",NA,"700","1968-07-26",NA,NA,NA,NA,"Jael","https://www.europarl.europa.eu/pdf/cardoc/CAHIER_SPECIAL_2011-WEBEN.pdf","0"
"365","ARUSHA_1968A","ARUSHA_1968A","Arusha Agreement 1","1968-07-26","ITA","1968-07-26",NA,NA,"Italy",NA,"700","1968-07-26",NA,NA,NA,NA,"Jael","https://www.europarl.europa.eu/pdf/cardoc/CAHIER_SPECIAL_2011-WEBEN.pdf","0"
"366","ARUSHA_1968A","ARUSHA_1968A","Arusha Agreement 1","1968-07-26","KEN","1968-07-26",NA,NA,"Kenya",NA,"700","1968-07-26",NA,NA,NA,NA,"Jael","https://www.europarl.europa.eu/pdf/cardoc/CAHIER_SPECIAL_2011-WEBEN.pdf","0"
"367","ARUSHA_1968A","ARUSHA_1968A","Arusha Agreement 1","1968-07-26","LUX","1968-07-26",NA,NA,"Luxembourg",NA,"700","1968-07-26",NA,NA,NA,NA,"Jael","https://www.europarl.europa.eu/pdf/cardoc/CAHIER_SPECIAL_2011-WEBEN.pdf","0"
"368","ARUSHA_1968A","ARUSHA_1968A","Arusha Agreement 1","1968-07-26","NLD","1968-07-26",NA,NA,"Netherlands",NA,"700","1968-07-26",NA,NA,NA,NA,"Jael","https://www.europarl.europa.eu/pdf/cardoc/CAHIER_SPECIAL_2011-WEBEN.pdf","0"
"369","ARUSHA_1968A","ARUSHA_1968A","Arusha Agreement 1","1968-07-26","TZA","1968-07-26",NA,NA,"Tanzania",NA,"700","1968-07-26",NA,NA,NA,NA,"Jael","https://www.europarl.europa.eu/pdf/cardoc/CAHIER_SPECIAL_2011-WEBEN.pdf","0"
"370","ARUSHA_1968A","ARUSHA_1968A","Arusha Agreement 1","1968-07-26","UGA","1968-07-26",NA,NA,"Uganda",NA,"700","1968-07-26",NA,NA,NA,NA,"Jael","https://www.europarl.europa.eu/pdf/cardoc/CAHIER_SPECIAL_2011-WEBEN.pdf","0"
"371","ECTNSA_1969A","ECTNSA_1969A","EC Tunisia Association Agreement","1969-03-28","BEL","1969-03-28","1969-09-01","01.11.1978","Belgium",NA,"353",NA,NA,NA,"1978-11-01",NA,"Anders",NA,"0"
"372","ECTNSA_1969A","ECTNSA_1969A","EC Tunisia Association Agreement","1969-03-28","DEU","1969-03-28","1969-09-01","01.11.1978","Germany",NA,"353",NA,NA,NA,"1978-11-01",NA,"Anders",NA,"0"
"373","ECTNSA_1969A","ECTNSA_1969A","EC Tunisia Association Agreement","1969-03-28","FRA","1969-03-28","1969-09-01","01.11.1978","France",NA,"353",NA,NA,NA,"1978-11-01",NA,"Anders",NA,"0"
"374","ECTNSA_1969A","ECTNSA_1969A","EC Tunisia Association Agreement","1969-03-28","ITA","1969-03-28","1969-09-01","01.11.1978","Italy",NA,"353",NA,NA,NA,"1978-11-01",NA,"Anders",NA,"0"
"375","ECTNSA_1969A","ECTNSA_1969A","EC Tunisia Association Agreement","1969-03-28","LUX","1969-03-28","1969-09-01","01.11.1978","Luxembourg",NA,"353",NA,NA,NA,"1978-11-01",NA,"Anders",NA,"0"
"376","ECTNSA_1969A","ECTNSA_1969A","EC Tunisia Association Agreement","1969-03-28","NLD","1969-03-28","1969-09-01","01.11.1978","Netherlands",NA,"353",NA,NA,NA,"1978-11-01",NA,"Anders",NA,"0"
"377","ECTNSA_1969A","ECTNSA_1969A","EC Tunisia Association Agreement","1969-03-28","TUN","1969-03-28","1969-09-01","01.11.1978","Tunisia",NA,"353",NA,NA,NA,"1978-11-01",NA,"Anders",NA,"0"
"378","ECMRCA_1969A","ECMRCA_1969A","EC Morocco Association Agreement","1969-03-31","BEL","1969-03-31","1969-09-01","01.11.1978","Belgium",NA,"333",NA,NA,NA,"1978-11-01",NA,"Anders",NA,"0"
"379","ECMRCA_1969A","ECMRCA_1969A","EC Morocco Association Agreement","1969-03-31","DEU","1969-03-31","1969-09-01","01.11.1978","Germany",NA,"333",NA,NA,NA,"1978-11-01",NA,"Anders",NA,"0"
"380","ECMRCA_1969A","ECMRCA_1969A","EC Morocco Association Agreement","1969-03-31","FRA","1969-03-31","1969-09-01","01.11.1978","France",NA,"333",NA,NA,NA,"1978-11-01",NA,"Anders",NA,"0"
"381","ECMRCA_1969A","ECMRCA_1969A","EC Morocco Association Agreement","1969-03-31","ITA","1969-03-31","1969-09-01","01.11.1978","Italy",NA,"333",NA,NA,NA,"1978-11-01",NA,"Anders",NA,"0"
"382","ECMRCA_1969A","ECMRCA_1969A","EC Morocco Association Agreement","1969-03-31","LUX","1969-03-31","1969-09-01","01.11.1978","Luxembourg",NA,"333",NA,NA,NA,"1978-11-01",NA,"Anders",NA,"0"
"383","ECMRCA_1969A","ECMRCA_1969A","EC Morocco Association Agreement","1969-03-31","MAR","1969-03-31","1969-09-01","01.11.1978","Morocco",NA,"333",NA,NA,NA,"1978-11-01",NA,"Anders",NA,"0"
"384","ECMRCA_1969A","ECMRCA_1969A","EC Morocco Association Agreement","1969-03-31","NLD","1969-03-31","1969-09-01","01.11.1978","Netherlands",NA,"333",NA,NA,NA,"1978-11-01",NA,"Anders",NA,"0"
"385","ANDNGC_1969A","ANDNGC_1969A","Andean Group Cartagena Agreement","1969-05-26","BOL","1969-05-26","1969-10-16","31.12.9999","Bolivia",NA,"26","1969-05-26",NA,"1969-10-16","9999-12-31",NA,"Jael",NA,"0"
"386","ANDNGC_1969A","ANDNGC_1969A","Andean Group Cartagena Agreement","1969-05-26","CHL","1969-05-26","1969-10-16","31.12.9999","Chile",NA,"26","1969-05-26",NA,"1969-10-16","1976",NA,"Jael",NA,"0"
"387","ANDNGC_1969A","ANDNGC_1969A","Andean Group Cartagena Agreement","1969-05-26","COL","1969-05-26","1969-10-16","31.12.9999","Colombia",NA,"26","1969-05-26",NA,"1969-10-16","9999-12-31",NA,"Jael",NA,"0"
"388","ANDNGC_1969A","ANDNGC_1969A","Andean Group Cartagena Agreement","1969-05-26","ECU","1969-05-26","1969-10-16","31.12.9999","Ecuador",NA,"26","1969-05-26",NA,"1969-10-16","9999-12-31",NA,"Jael",NA,"0"
"389","ANDNGC_1969A","ANDNGC_1969A","Andean Group Cartagena Agreement","1969-05-26","PER","1969-05-26","1969-10-16","31.12.9999","Peru",NA,"26","1969-05-26",NA,"1969-10-16","9999-12-31",NA,"Jael",NA,"0"
"390","ANDNGC_1969A","ANDNGC_1969A","Andean Group Cartagena Agreement","1969-05-26","VEN","1969-05-26","1969-10-16","31.12.9999","Venezuela",NA,"26",NA,"1973",NA,"2006",NA,"Jael",NA,"0"
"391","YAOUND_1969O2","YAOUND_1969O2","Yaounde 2","1969-07-29","BDI","1969-07-29","1971-01-01","01.04.1976","Burundi",NA,"690","1969-07-29",NA,"1971-01-01","1976-04-01",NA,"Jael",NA,"0"
"392","YAOUND_1969O2","YAOUND_1969O2","Yaounde 2","1969-07-29","BEL","1969-07-29","1971-01-01","01.04.1976","Belgium",NA,"690","1969-07-29",NA,"1971-01-01","1976-04-01",NA,"Jael",NA,"0"
"393","YAOUND_1969O2","YAOUND_1969O2","Yaounde 2","1969-07-29","BEN","1969-07-29","1971-01-01","01.04.1976","Benin",NA,"690","1969-07-29",NA,"1971-01-01","1976-04-01",NA,"Jael",NA,"0"
"394","YAOUND_1969O2","YAOUND_1969O2","Yaounde 2","1969-07-29","BFA","1969-07-29","1971-01-01","01.04.1976","Burkina Faso",NA,"690","1969-07-29",NA,"1971-01-01","1976-04-01",NA,"Jael",NA,"0"
"395","YAOUND_1969O2","YAOUND_1969O2","Yaounde 2","1969-07-29","CAF","1969-07-29","1971-01-01","01.04.1976","Central African Republic",NA,"690","1969-07-29",NA,"1971-01-01","1976-04-01",NA,"Jael",NA,"0"
"396","YAOUND_1969O2","YAOUND_1969O2","Yaounde 2","1969-07-29","CIV","1969-07-29","1971-01-01","01.04.1976","Cote d'Ivoire",NA,"690","1969-07-29",NA,"1971-01-01","1976-04-01",NA,"Jael",NA,"0"
"397","YAOUND_1969O2","YAOUND_1969O2","Yaounde 2","1969-07-29","CMR","1969-07-29","1971-01-01","01.04.1976","Cameroon",NA,"690","1969-07-29",NA,"1971-01-01","1976-04-01",NA,"Jael",NA,"0"
"398","YAOUND_1969O2","YAOUND_1969O2","Yaounde 2","1969-07-29","COD","1969-07-29","1971-01-01","01.04.1976","Democratic Republic of the Congo",NA,"690","1969-07-29",NA,"1971-01-01","1976-04-01",NA,"Jael",NA,"0"
"399","YAOUND_1969O2","YAOUND_1969O2","Yaounde 2","1969-07-29","COG","1969-07-29","1971-01-01","01.04.1976","Congo",NA,"690","1969-07-29",NA,"1971-01-01","1976-04-01",NA,"Jael",NA,"0"
"400","YAOUND_1969O2","YAOUND_1969O2","Yaounde 2","1969-07-29","DEU","1969-07-29","1971-01-01","01.04.1976","Germany",NA,"690","1969-07-29",NA,"1971-01-01","1976-04-01",NA,"Jael",NA,"0"
"401","YAOUND_1969O2","YAOUND_1969O2","Yaounde 2","1969-07-29","FRA","1969-07-29","1971-01-01","01.04.1976","France",NA,"690","1969-07-29",NA,"1971-01-01","1976-04-01",NA,"Jael",NA,"0"
"402","YAOUND_1969O2","YAOUND_1969O2","Yaounde 2","1969-07-29","GAB","1969-07-29","1971-01-01","01.04.1976","Gabon",NA,"690","1969-07-29",NA,"1971-01-01","1976-04-01",NA,"Jael",NA,"0"
"403","YAOUND_1969O2","YAOUND_1969O2","Yaounde 2","1969-07-29","ITA","1969-07-29","1971-01-01","01.04.1976","Italy",NA,"690","1969-07-29",NA,"1971-01-01","1976-04-01",NA,"Jael",NA,"0"
"404","YAOUND_1969O2","YAOUND_1969O2","Yaounde 2","1969-07-29","LUX","1969-07-29","1971-01-01","01.04.1976","Luxembourg",NA,"690","1969-07-29",NA,"1971-01-01","1976-04-01",NA,"Jael",NA,"0"
"405","YAOUND_1969O2","YAOUND_1969O2","Yaounde 2","1969-07-29","MDG","1969-07-29","1971-01-01","01.04.1976","Madagascar",NA,"690","1969-07-29",NA,"1971-01-01","1976-04-01",NA,"Jael",NA,"0"
"406","YAOUND_1969O2","YAOUND_1969O2","Yaounde 2","1969-07-29","MLI","1969-07-29","1971-01-01","01.04.1976","Mali",NA,"690","1969-07-29",NA,"1971-01-01","1976-04-01",NA,"Jael",NA,"0"
"407","YAOUND_1969O2","YAOUND_1969O2","Yaounde 2","1969-07-29","MRT","1969-07-29","1971-01-01","01.04.1976","Mauritania",NA,"690","1969-07-29",NA,"1971-01-01","1976-04-01",NA,"Jael",NA,"0"
"408","YAOUND_1969O2","YAOUND_1969O2","Yaounde 2","1969-07-29","NER","1969-07-29","1971-01-01","01.04.1976","Niger",NA,"690","1969-07-29",NA,"1971-01-01","1976-04-01",NA,"Jael",NA,"0"
"409","YAOUND_1969O2","YAOUND_1969O2","Yaounde 2","1969-07-29","NLD","1969-07-29","1971-01-01","01.04.1976","Netherlands",NA,"690","1969-07-29",NA,"1971-01-01","1976-04-01",NA,"Jael",NA,"0"
"410","YAOUND_1969O2","YAOUND_1969O2","Yaounde 2","1969-07-29","RWA","1969-07-29","1971-01-01","01.04.1976","Rwanda",NA,"690","1969-07-29",NA,"1971-01-01","1976-04-01",NA,"Jael",NA,"0"
"411","YAOUND_1969O2","YAOUND_1969O2","Yaounde 2","1969-07-29","SEN","1969-07-29","1971-01-01","01.04.1976","Senegal",NA,"690","1969-07-29",NA,"1971-01-01","1976-04-01",NA,"Jael",NA,"0"
"412","YAOUND_1969O2","YAOUND_1969O2","Yaounde 2","1969-07-29","SOM","1969-07-29","1971-01-01","01.04.1976","Somalia",NA,"690","1969-07-29",NA,"1971-01-01","1976-04-01",NA,"Jael",NA,"0"
"413","YAOUND_1969O2","YAOUND_1969O2","Yaounde 2","1969-07-29","TCD","1969-07-29","1971-01-01","01.04.1976","Chad",NA,"690","1969-07-29",NA,"1971-01-01","1976-04-01",NA,"Jael",NA,"0"
"414","YAOUND_1969O2","YAOUND_1969O2","Yaounde 2","1969-07-29","TGO","1969-07-29","1971-01-01","01.04.1976","Togo",NA,"690","1969-07-29",NA,"1971-01-01","1976-04-01",NA,"Jael",NA,"0"
"415","ARUSHA_1969A","ARUSHA_1969A","Arusha Agreement 2","1969-09-24","BEL","1969-09-24","1971-01-01","31.01.1975","Belgium",NA,"61","1969-09-24",NA,"1971-01-01","1975-01-31",NA,"Anders",NA,"0"
"416","ARUSHA_1969A","ARUSHA_1969A","Arusha Agreement 2","1969-09-24","DEU","1969-09-24","1971-01-01","31.01.1975","Germany",NA,"61","1969-09-24",NA,"1971-01-01","1975-01-31",NA,"Anders",NA,"0"
"417","ARUSHA_1969A","ARUSHA_1969A","Arusha Agreement 2","1969-09-24","FRA","1969-09-24","1971-01-01","31.01.1975","France",NA,"61","1969-09-24",NA,"1971-01-01","1975-01-31",NA,"Anders",NA,"0"
"418","ARUSHA_1969A","ARUSHA_1969A","Arusha Agreement 2","1969-09-24","ITA","1969-09-24","1971-01-01","31.01.1975","Italy",NA,"61","1969-09-24",NA,"1971-01-01","1975-01-31",NA,"Anders",NA,"0"
"419","ARUSHA_1969A","ARUSHA_1969A","Arusha Agreement 2","1969-09-24","KEN","1969-09-24","1971-01-01","31.01.1975","Kenya",NA,"61","1969-09-24",NA,"1971-01-01","1975-01-31",NA,"Anders",NA,"0"
"420","ARUSHA_1969A","ARUSHA_1969A","Arusha Agreement 2","1969-09-24","LUX","1969-09-24","1971-01-01","31.01.1975","Luxembourg",NA,"61","1969-09-24",NA,"1971-01-01","1975-01-31",NA,"Anders",NA,"0"
"421","ARUSHA_1969A","ARUSHA_1969A","Arusha Agreement 2","1969-09-24","NLD","1969-09-24","1971-01-01","31.01.1975","Netherlands",NA,"61","1969-09-24",NA,"1971-01-01","1975-01-31",NA,"Anders",NA,"0"
"422","ARUSHA_1969A","ARUSHA_1969A","Arusha Agreement 2","1969-09-24","TZA","1969-09-24","1971-01-01","31.01.1975","Tanzania",NA,"61","1969-09-24",NA,"1971-01-01","1975-01-31",NA,"Anders",NA,"0"
"423","ARUSHA_1969A","ARUSHA_1969A","Arusha Agreement 2","1969-09-24","UGA","1969-09-24","1971-01-01","31.01.1975","Uganda",NA,"61","1969-09-24",NA,"1971-01-01","1975-01-31",NA,"Anders",NA,"0"
"424","STHACU_1969O","STHACU_1969O","Southern Africa Customs Union (SACU)","1969-12-11","BWA","1969-12-11","1970-03-01","15.07.2004","Botswana",NA,"669","1969-12-11",NA,"1970-03-01","2004-07-15",NA,"Anders",NA,"0"
"425","STHACU_1969O","STHACU_1969O","Southern Africa Customs Union (SACU)","1969-12-11","LSO","1969-12-11","1970-03-01","15.07.2004","Lesotho",NA,"669","1969-12-11",NA,"1970-03-01","2004-07-15",NA,"Anders",NA,"0"
"426","STHACU_1969O","STHACU_1969O","Southern Africa Customs Union (SACU)","1969-12-11","SWZ","1969-12-11","1970-03-01","15.07.2004","Eswatini",NA,"669","1969-12-11",NA,"1970-03-01","2004-07-15",NA,"Anders",NA,"0"
"427","STHACU_1969O","STHACU_1969O","Southern Africa Customs Union (SACU)","1969-12-11","ZAF","1969-12-11","1970-03-01","15.07.2004","South Africa",NA,"669","1969-12-11",NA,"1970-03-01","2004-07-15",NA,"Anders",NA,"0"
"428","STHACU_1969O","STHACU_1969O","Southern Africa Customs Union (SACU)","1969-12-11","NAM","1969-12-11","1970-03-01","15.07.2004","Namibia",NA,"669",NA,NA,"1990-07-06","2004-07-15",NA,"Jael",NA,"0"
"429","PAN-SLV[NA]_1970O","PAN-SLV[NA]_1970O","El Salvador Panama","1970-06-02","PAN","1970-06-02",NA,NA,"Panama","209",NA,"1970-06-02",NA,NA,NA,NA,"Anders",NA,"0"
"430","PAN-SLV[NA]_1970O","PAN-SLV[NA]_1970O","El Salvador Panama","1970-06-02","SLV","1970-06-02",NA,NA,"El Salvador","209",NA,"1970-06-02",NA,NA,NA,NA,"Anders",NA,"0"
"431","ECISRL_1970O","ECISRL_1970O","EC Israel","1970-06-29","BEL","1970-06-29","1970-10-01","29.05.1975","Belgium",NA,"314","1970-06-29",NA,"1970-10-01","1975-05-29",NA,"Jael","https://ec.europa.eu/commission/presscorner/detail/en/MEMO_93_38","0"
"432","ECISRL_1970O","ECISRL_1970O","EC Israel","1970-06-29","DEU","1970-06-29","1970-10-01","29.05.1975","Germany",NA,"314","1970-06-29",NA,"1970-10-01","1975-05-29",NA,"Jael","https://ec.europa.eu/commission/presscorner/detail/en/MEMO_93_38","0"
"433","ECISRL_1970O","ECISRL_1970O","EC Israel","1970-06-29","FRA","1970-06-29","1970-10-01","29.05.1975","France",NA,"314","1970-06-29",NA,"1970-10-01","1975-05-29",NA,"Jael","https://ec.europa.eu/commission/presscorner/detail/en/MEMO_93_38","0"
"434","ECISRL_1970O","ECISRL_1970O","EC Israel","1970-06-29","ISR","1970-06-29","1970-10-01","29.05.1975","Israel",NA,"314","1970-06-29",NA,"1970-10-01","1975-05-29",NA,"Jael","https://ec.europa.eu/commission/presscorner/detail/en/MEMO_93_38","0"
"435","ECISRL_1970O","ECISRL_1970O","EC Israel","1970-06-29","ITA","1970-06-29","1970-10-01","29.05.1975","Italy",NA,"314","1970-06-29",NA,"1970-10-01","1975-05-29",NA,"Jael","https://ec.europa.eu/commission/presscorner/detail/en/MEMO_93_38","0"
"436","ECISRL_1970O","ECISRL_1970O","EC Israel","1970-06-29","LUX","1970-06-29","1970-10-01","29.05.1975","Luxembourg",NA,"314","1970-06-29",NA,"1970-10-01","1975-05-29",NA,"Jael","https://ec.europa.eu/commission/presscorner/detail/en/MEMO_93_38","0"
"437","ECISRL_1970O","ECISRL_1970O","EC Israel","1970-06-29","NLD","1970-06-29","1970-10-01","29.05.1975","Netherlands",NA,"314","1970-06-29",NA,"1970-10-01","1975-05-29",NA,"Jael","https://ec.europa.eu/commission/presscorner/detail/en/MEMO_93_38","0"
"438","ECSPAN_1970O","ECSPAN_1970O","EC Spain","1970-07-20","BEL","1970-07-20","1970-08-19","31.12.1985","Belgium",NA,"348","1970-07-20",NA,"1970-08-19","1985-12-31",NA,"Jael",NA,"0"
"439","ECSPAN_1970O","ECSPAN_1970O","EC Spain","1970-07-20","DEU","1970-07-20","1970-08-19","31.12.1985","Germany",NA,"348","1970-07-20",NA,"1970-08-19","1985-12-31",NA,"Jael",NA,"0"
"440","ECSPAN_1970O","ECSPAN_1970O","EC Spain","1970-07-20","ESP","1970-07-20","1970-08-19","31.12.1985","Spain",NA,"348","1970-07-20",NA,"1970-08-19","1985-12-31",NA,"Jael",NA,"0"
"441","ECSPAN_1970O","ECSPAN_1970O","EC Spain","1970-07-20","FRA","1970-07-20","1970-08-19","31.12.1985","France",NA,"348","1970-07-20",NA,"1970-08-19","1985-12-31",NA,"Jael",NA,"0"
"442","ECSPAN_1970O","ECSPAN_1970O","EC Spain","1970-07-20","ITA","1970-07-20","1970-08-19","31.12.1985","Italy",NA,"348","1970-07-20",NA,"1970-08-19","1985-12-31",NA,"Jael",NA,"0"
"443","ECSPAN_1970O","ECSPAN_1970O","EC Spain","1970-07-20","LUX","1970-07-20","1970-08-19","31.12.1985","Luxembourg",NA,"348","1970-07-20",NA,"1970-08-19","1985-12-31",NA,"Jael",NA,"0"
"444","ECSPAN_1970O","ECSPAN_1970O","EC Spain","1970-07-20","NLD","1970-07-20","1970-08-19","31.12.1985","Netherlands",NA,"348","1970-07-20",NA,"1970-08-19","1985-12-31",NA,"Jael",NA,"0"
"445","ECOVCT_1970O","ECOVCT_1970O","EC Overseas Countries And Territories (OCT)","1970-09-29","ABW","1970-09-29","1971-01-01","31.07.1975","Aruba","161","985","1970-09-29",NA,"1971-01-01","1975-07-31",NA,"Anders",NA,"0"
"446","ECOVCT_1970O","ECOVCT_1970O","EC Overseas Countries And Territories (OCT)","1970-09-29","AIA","1970-09-29","1971-01-01","31.07.1975","Anguilla","161","985","1970-09-29",NA,"1971-01-01","1975-07-31",NA,"Anders",NA,"0"
"447","ECOVCT_1970O","ECOVCT_1970O","EC Overseas Countries And Territories (OCT)","1970-09-29","ATF","1970-09-29","1971-01-01","31.07.1975","French Southern Territories","161","985","1970-09-29",NA,"1971-01-01","1975-07-31",NA,"Anders",NA,"0"
"448","ECOVCT_1970O","ECOVCT_1970O","EC Overseas Countries And Territories (OCT)","1970-09-29","BEL","1970-09-29","1971-01-01","31.07.1975","Belgium","161","985","1970-09-29",NA,"1971-01-01","1975-07-31",NA,"Anders",NA,"0"
"449","ECOVCT_1970O","ECOVCT_1970O","EC Overseas Countries And Territories (OCT)","1970-09-29","CYM","1970-09-29","1971-01-01","31.07.1975","Cayman Islands","161","985","1970-09-29",NA,"1971-01-01","1975-07-31",NA,"Anders",NA,"0"
"450","ECOVCT_1970O","ECOVCT_1970O","EC Overseas Countries And Territories (OCT)","1970-09-29","DEU","1970-09-29","1971-01-01","31.07.1975","Germany","161","985","1970-09-29",NA,"1971-01-01","1975-07-31",NA,"Anders",NA,"0"
"451","ECOVCT_1970O","ECOVCT_1970O","EC Overseas Countries And Territories (OCT)","1970-09-29","FLK","1970-09-29","1971-01-01","31.07.1975","Falkland Islands","161","985","1970-09-29",NA,"1971-01-01","1975-07-31",NA,"Anders",NA,"0"
"452","ECOVCT_1970O","ECOVCT_1970O","EC Overseas Countries And Territories (OCT)","1970-09-29","FRA","1970-09-29","1971-01-01","31.07.1975","France","161","985","1970-09-29",NA,"1971-01-01","1975-07-31",NA,"Anders",NA,"0"
"453","ECOVCT_1970O","ECOVCT_1970O","EC Overseas Countries And Territories (OCT)","1970-09-29","GRL","1970-09-29","1971-01-01","31.07.1975","Greenland","161","985","1970-09-29",NA,"1971-01-01","1975-07-31",NA,"Anders",NA,"0"
"454","ECOVCT_1970O","ECOVCT_1970O","EC Overseas Countries And Territories (OCT)","1970-09-29","IOT","1970-09-29","1971-01-01","31.07.1975","British Indian Ocean Territory","161","985","1970-09-29",NA,"1971-01-01","1975-07-31",NA,"Anders",NA,"0"
"455","ECOVCT_1970O","ECOVCT_1970O","EC Overseas Countries And Territories (OCT)","1970-09-29","ITA","1970-09-29","1971-01-01","31.07.1975","Italy","161","985","1970-09-29",NA,"1971-01-01","1975-07-31",NA,"Anders",NA,"0"
"456","ECOVCT_1970O","ECOVCT_1970O","EC Overseas Countries And Territories (OCT)","1970-09-29","LUX","1970-09-29","1971-01-01","31.07.1975","Luxembourg","161","985","1970-09-29",NA,"1971-01-01","1975-07-31",NA,"Anders",NA,"0"
"457","ECOVCT_1970O","ECOVCT_1970O","EC Overseas Countries And Territories (OCT)","1970-09-29","MSR","1970-09-29","1971-01-01","31.07.1975","Montserrat","161","985","1970-09-29",NA,"1971-01-01","1975-07-31",NA,"Anders",NA,"0"
"458","ECOVCT_1970O","ECOVCT_1970O","EC Overseas Countries And Territories (OCT)","1970-09-29","MYT","1970-09-29","1971-01-01","31.07.1975","Mayotte","161","985","1970-09-29",NA,"1971-01-01","1975-07-31",NA,"Anders",NA,"0"
"459","ECOVCT_1970O","ECOVCT_1970O","EC Overseas Countries And Territories (OCT)","1970-09-29","NCL","1970-09-29","1971-01-01","31.07.1975","New Caledonia","161","985","1970-09-29",NA,"1971-01-01","1975-07-31",NA,"Anders",NA,"0"
"460","ECOVCT_1970O","ECOVCT_1970O","EC Overseas Countries And Territories (OCT)","1970-09-29","NLD","1970-09-29","1971-01-01","31.07.1975","Netherlands","161","985","1970-09-29",NA,"1971-01-01","1975-07-31",NA,"Anders",NA,"0"
"461","ECOVCT_1970O","ECOVCT_1970O","EC Overseas Countries And Territories (OCT)","1970-09-29","PCN","1970-09-29","1971-01-01","31.07.1975","Pitcairn Islands","161","985","1970-09-29",NA,"1971-01-01","1975-07-31",NA,"Anders",NA,"0"
"462","ECOVCT_1970O","ECOVCT_1970O","EC Overseas Countries And Territories (OCT)","1970-09-29","PYF","1970-09-29","1971-01-01","31.07.1975","French Polynesia","161","985","1970-09-29",NA,"1971-01-01","1975-07-31",NA,"Anders",NA,"0"
"463","ECOVCT_1970O","ECOVCT_1970O","EC Overseas Countries And Territories (OCT)","1970-09-29","SGS","1970-09-29","1971-01-01","31.07.1975","South Georgia and South Sandwich Islands","161","985","1970-09-29",NA,"1971-01-01","1975-07-31",NA,"Anders",NA,"0"
"464","ECOVCT_1970O","ECOVCT_1970O","EC Overseas Countries And Territories (OCT)","1970-09-29","SHN","1970-09-29","1971-01-01","31.07.1975","St. Helena","161","985","1970-09-29",NA,"1971-01-01","1975-07-31",NA,"Anders",NA,"0"
"465","ECOVCT_1970O","ECOVCT_1970O","EC Overseas Countries And Territories (OCT)","1970-09-29","SPM","1970-09-29","1971-01-01","31.07.1975","St. Pierre and Miquelon","161","985","1970-09-29",NA,"1971-01-01","1975-07-31",NA,"Anders",NA,"0"
"466","ECOVCT_1970O","ECOVCT_1970O","EC Overseas Countries And Territories (OCT)","1970-09-29","TCA","1970-09-29","1971-01-01","31.07.1975","Turks and Caicos Islands","161","985","1970-09-29",NA,"1971-01-01","1975-07-31",NA,"Anders",NA,"0"
"467","ECOVCT_1970O","ECOVCT_1970O","EC Overseas Countries And Territories (OCT)","1970-09-29","VGB","1970-09-29","1971-01-01","31.07.1975","British Virgin Islands","161","985","1970-09-29",NA,"1971-01-01","1975-07-31",NA,"Anders",NA,"0"
"468","ECOVCT_1970O","ECOVCT_1970O","EC Overseas Countries And Territories (OCT)","1970-09-29","WLF","1970-09-29","1971-01-01","31.07.1975","Wallis and Futuna","161","985","1970-09-29",NA,"1971-01-01","1975-07-31",NA,"Anders",NA,"0"
"469","ECOVCT_1970O","ECOVCT_1970O","EC Overseas Countries And Territories (OCT)","1970-09-29","DNK","1970-09-29","1971-01-01","31.07.1975","Denmark","161","985",NA,NA,"1973-01-01","1975-07-31",NA,"Jael",NA,"0"
"470","ECOVCT_1970O","ECOVCT_1970O","EC Overseas Countries And Territories (OCT)","1970-09-29","EC","1970-09-29","1971-01-01","31.07.1975","European Community","161","985",NA,NA,"1971-01-01","1975-07-31",NA,"Jael",NA,"0"
"471","ECOVCT_1970O","ECOVCT_1970O","EC Overseas Countries And Territories (OCT)","1970-09-29","GBR","1970-09-29","1971-01-01","31.07.1975","United Kingdom","161","985",NA,NA,"1973-01-01","1975-07-31",NA,"Jael",NA,"0"
"472","ECOVCT_1970O","ECOVCT_1970O","EC Overseas Countries And Territories (OCT)","1970-09-29","IRL","1970-09-29","1971-01-01","31.07.1975","Ireland","161","985",NA,NA,"1973-01-01","1975-07-31",NA,"Jael",NA,"0"
"473","ECTRKA_1970P","ECTRKA_1970P","EC Turkey Additional Protocol","1970-11-23","BEL","1970-11-23","1973-01-01","31.12.9999","Belgium",NA,"357","1970-11-23",NA,"1973-01-01","9999-12-31",NA,"Anders",NA,"0"
"474","ECTRKA_1970P","ECTRKA_1970P","EC Turkey Additional Protocol","1970-11-23","DEU","1970-11-23","1973-01-01","31.12.9999","Germany",NA,"357","1970-11-23",NA,"1973-01-01","9999-12-31",NA,"Anders",NA,"0"
"475","ECTRKA_1970P","ECTRKA_1970P","EC Turkey Additional Protocol","1970-11-23","FRA","1970-11-23","1973-01-01","31.12.9999","France",NA,"357","1970-11-23",NA,"1973-01-01","9999-12-31",NA,"Anders",NA,"0"
"476","ECTRKA_1970P","ECTRKA_1970P","EC Turkey Additional Protocol","1970-11-23","ITA","1970-11-23","1973-01-01","31.12.9999","Italy",NA,"357","1970-11-23",NA,"1973-01-01","9999-12-31",NA,"Anders",NA,"0"
"477","ECTRKA_1970P","ECTRKA_1970P","EC Turkey Additional Protocol","1970-11-23","LUX","1970-11-23","1973-01-01","31.12.9999","Luxembourg",NA,"357","1970-11-23",NA,"1973-01-01","9999-12-31",NA,"Anders",NA,"0"
"478","ECTRKA_1970P","ECTRKA_1970P","EC Turkey Additional Protocol","1970-11-23","NLD","1970-11-23","1973-01-01","31.12.9999","Netherlands",NA,"357","1970-11-23",NA,"1973-01-01","9999-12-31",NA,"Anders",NA,"0"
"479","ECTRKA_1970P","ECTRKA_1970P","EC Turkey Additional Protocol","1970-11-23","TUR","1970-11-23","1973-01-01","31.12.9999","Turkey",NA,"357","1970-11-23",NA,"1973-01-01","9999-12-31",NA,"Anders",NA,"0"
"480","ECMALT_1970O","ECMALT_1970O","EC Malta","1970-12-05","BEL","1970-12-05","1971-04-01","01.05.2004","Belgium","155","329","1970-12-05",NA,"1971-04-01","2004-05-01",NA,"Anders",NA,"0"
"481","ECMALT_1970O","ECMALT_1970O","EC Malta","1970-12-05","DEU","1970-12-05","1971-04-01","01.05.2004","Germany","155","329","1970-12-05",NA,"1971-04-01","2004-05-01",NA,"Anders",NA,"0"
"482","ECMALT_1970O","ECMALT_1970O","EC Malta","1970-12-05","FRA","1970-12-05","1971-04-01","01.05.2004","France","155","329","1970-12-05",NA,"1971-04-01","2004-05-01",NA,"Anders",NA,"0"
"483","ECMALT_1970O","ECMALT_1970O","EC Malta","1970-12-05","ITA","1970-12-05","1971-04-01","01.05.2004","Italy","155","329","1970-12-05",NA,"1971-04-01","2004-05-01",NA,"Anders",NA,"0"
"484","ECMALT_1970O","ECMALT_1970O","EC Malta","1970-12-05","LUX","1970-12-05","1971-04-01","01.05.2004","Luxembourg","155","329","1970-12-05",NA,"1971-04-01","2004-05-01",NA,"Anders",NA,"0"
"485","ECMALT_1970O","ECMALT_1970O","EC Malta","1970-12-05","MLT","1970-12-05","1971-04-01","01.05.2004","Malta","155","329","1970-12-05",NA,"1971-04-01","2004-05-01",NA,"Anders",NA,"0"
"486","ECMALT_1970O","ECMALT_1970O","EC Malta","1970-12-05","NLD","1970-12-05","1971-04-01","01.05.2004","Netherlands","155","329","1970-12-05",NA,"1971-04-01","2004-05-01",NA,"Anders",NA,"0"
"487","ECMALT_1970O","ECMALT_1970O","EC Malta","1970-12-05","AUT","1970-12-05","1971-01-04","01.05.2004","Austria","155","329",NA,NA,"1995-01-01","2004-05-01",NA,"Jael",NA,"0"
"488","ECMALT_1970O","ECMALT_1970O","EC Malta","1970-12-05","DNK","1970-12-05","1971-01-04","01.05.2004","Denmark","155","329","1970-12-05",NA,"1971-04-01","2004-05-01",NA,"Jael",NA,"0"
"489","ECMALT_1970O","ECMALT_1970O","EC Malta","1970-12-05","ESP","1970-12-05","1971-01-04","01.05.2004","Spain","155","329",NA,NA,"1986-01-01","2004-05-01",NA,"Jael",NA,"0"
"490","ECMALT_1970O","ECMALT_1970O","EC Malta","1970-12-05","FIN","1970-12-05","1971-01-04","01.05.2004","Finland","155","329",NA,NA,"1995-01-01","2004-05-01",NA,"Jael",NA,"0"
"491","ECMALT_1970O","ECMALT_1970O","EC Malta","1970-12-05","GBR","1970-12-05","1971-01-04","01.05.2004","United Kingdom","155","329","1970-12-05",NA,"1971-04-01","2004-05-01",NA,"Jael",NA,"0"
"492","ECMALT_1970O","ECMALT_1970O","EC Malta","1970-12-05","GRC","1970-12-05","1971-01-04","01.05.2004","Greece","155","329","1970-12-05",NA,"1971-04-01","2004-05-01",NA,"Jael",NA,"0"
"493","ECMALT_1970O","ECMALT_1970O","EC Malta","1970-12-05","IRL","1970-12-05","1971-01-04","01.05.2004","Ireland","155","329","1970-12-05",NA,"1971-04-01","2004-05-01",NA,"Jael",NA,"0"
"494","ECMALT_1970O","ECMALT_1970O","EC Malta","1970-12-05","PRT","1970-12-05","1971-01-04","01.05.2004","Portugal","155","329",NA,NA,"1986-01-01","2004-05-01",NA,"Jael",NA,"0"
"495","ECMALT_1970O","ECMALT_1970O","EC Malta","1970-12-05","SWE","1970-12-05","1971-01-04","01.05.2004","Sweden","155","329",NA,NA,"1995-01-01","2004-05-01",NA,"Jael",NA,"0"
"496","TRDNGT_1971P","TRDNGT_1971P","Protocol On Trade Negotiations (PTN)","1971-12-08","BGD","1971-12-08","1973-02-11","31.12.9999","Bangladesh","315","647","1971-12-08",NA,"1973-02-11",NA,NA,"Anders",NA,"0"
"497","TRDNGT_1971P","TRDNGT_1971P","Protocol On Trade Negotiations (PTN)","1971-12-08","BRA","1971-12-08","1973-02-11","31.12.9999","Brazil","315","647","1971-12-08",NA,"1973-02-11",NA,NA,"Anders",NA,"0"
"498","TRDNGT_1971P","TRDNGT_1971P","Protocol On Trade Negotiations (PTN)","1971-12-08","CHL","1971-12-08","1973-02-11","31.12.9999","Chile","315","647","1971-12-08",NA,"1973-02-11",NA,NA,"Anders",NA,"0"
"499","TRDNGT_1971P","TRDNGT_1971P","Protocol On Trade Negotiations (PTN)","1971-12-08","EGY","1971-12-08","1973-02-11","31.12.9999","Egypt","315","647","1971-12-08",NA,"1973-02-11",NA,NA,"Anders",NA,"0"
"500","TRDNGT_1971P","TRDNGT_1971P","Protocol On Trade Negotiations (PTN)","1971-12-08","ESP","1971-12-08","1973-02-11","31.12.9999","Spain","315","647","1971-12-08",NA,"1973-02-11","1985-12-31",NA,"Anders",NA,"0"
"501","TRDNGT_1971P","TRDNGT_1971P","Protocol On Trade Negotiations (PTN)","1971-12-08","IND","1971-12-08","1973-02-11","31.12.9999","India","315","647","1971-12-08",NA,"1973-02-11",NA,NA,"Anders",NA,"0"
"502","TRDNGT_1971P","TRDNGT_1971P","Protocol On Trade Negotiations (PTN)","1971-12-08","ISR","1971-12-08","1973-02-11","31.12.9999","Israel","315","647","1971-12-08",NA,"1973-02-11",NA,NA,"Anders",NA,"0"
"503","TRDNGT_1971P","TRDNGT_1971P","Protocol On Trade Negotiations (PTN)","1971-12-08","KOR","1971-12-08","1973-02-11","31.12.9999","Republic of Korea","315","647","1971-12-08",NA,"1973-02-11",NA,NA,"Anders",NA,"0"
